date,title
2023-06-14 07:00:00,Larry Fink Says AI Could Be the Technology That Curbs Inflation
2023-06-16 07:00:00,Are Stocks a Good Hedge Against Inflation?
2023-06-13 07:00:00,Cost Inflation Could Add $280bn in Capital Expenditure for Offshore Wind Industry
2023-06-15 07:00:00,Bills Bills Bills: Beyoncé blamed for Sweden’s shock rise in inflation
2023-06-16 07:00:00,"The Fed Left Interest Rates Unchanged, for Now (Published 2023)"
2023-06-15 07:00:00,Nigeria inflation rises in May on higher food prices
2023-06-14 07:00:00,"US Fed holds interest rates steady, indicates hikes upcoming"
2023-06-13 07:00:00,Greedy Businesses Isn’t the Only Problem With Inflation
2023-06-14 07:00:00,When will cheaper fixed energy tariffs return... and should you take one?
2023-06-15 07:00:00,"Mortgage rates rising: What is a mortgage, and why are they getting more expensive?"
2023-06-13 07:00:00,Fed Rate Pause Set to Get Support From Moderating CPI Inflation Data
2023-06-12 07:00:00,Hard for Bank of England to fine-tune end of rate-tightening: BoE's Mann
2023-06-23 07:00:00,The market for inflation risk
2023-06-22 07:00:00,Turkey hikes interest rates as Erdogan stages economic U-turn
2023-06-22 07:00:00,HMRC late payment interest rates to be revised after Bank of England increases base rate
2023-06-22 07:00:00,What can Rishi Sunak do to tackle inflation?
2023-06-22 07:00:00,The end of Erdoğanomics? Turkey almost doubles interest rates to fight inflation
2023-06-19 07:00:00,Investing in times of inflation
2023-06-22 07:00:00,Bank of England raises interest rates by 0.5 percentage points
2023-06-22 07:00:00,Turkish central bank raises interest rates to 15% after two-year freeze
2023-06-21 07:00:00,Britain’s inflation pain is mostly self-inflicted and getting worse
2023-06-20 07:00:00,UK grocery inflation falls to slowest monthly rate this year but shoppers still feeling the pressure
2023-06-21 07:00:00,Is Brexit behind the UK's inflation shock?
2023-06-22 07:00:00,Interest rates set to rise for 13th time in a row
2023-06-20 07:00:00,Why is inflation in the UK worse than in other major economies?
2023-06-21 07:00:00,UK inflation stays at 8.7% despite hopes of a fall
2023-06-22 07:00:00,Bank of England raises interest rates by a half point to 5%
2023-06-21 07:00:00,Chris Mason: Rishi Sunak is in a bind over inflation
2023-06-23 07:00:00,Rishi Sunak forced to acknowledge control of inflation lies with Bank of England
2023-06-23 07:00:00,Why are UK banks taking so long to pass higher interest rates on to savers?
2023-06-22 07:00:00,Interest rates: Bank of England boss denies wanting recession as rates rise
2023-06-21 07:00:00,Explainer: Why is inflation so high in the UK?
2023-06-22 07:00:00,Brexit Can’t Be Blamed for Britain’s High Inflation
2023-06-21 07:00:00,Jay Powell says US inflation battle not over but defends ‘prudent’ pause
2023-06-21 07:00:00,U.K. Inflation Remains Stuck at 8.7% (Published 2023)
2023-06-21 07:00:00,"Causes, consequences of UK’s stubbornly-high inflation"
2023-06-21 07:00:00,Interest rate hikes could see 1.4 million people lose 20% of their disposable income
2023-06-21 07:00:00,Inflation has pushed up prices by 25% on average since 2018: Use our calculator to check impact on your shopping basket
2023-06-23 07:00:00,Low-income mortgage holders must not be ignored amid interest rate rises
2023-06-19 07:00:00,UK introduces new post-Brexit trading scheme for developing countries
2023-06-21 07:00:00,"Will the Taylor tour spur inflation? No, but a Swift spending spree might just save us from a recession"
2023-06-20 07:00:00,"Inflation forces supermarkets to up £1 items to £1.25, data shows"
2023-06-21 07:00:00,What is the difference between core inflation and headline inflation?
2023-06-21 07:00:00,Study shows gap between perceived and actual inflation – in Germany the gap is particularly wide
2023-06-21 07:00:00,Watch: UK inflation troubles weigh on the Bank of England
2023-06-21 08:56:05,Articles
2023-06-20 07:00:00,Is food inflation higher in Europe than in the UK?
2023-06-21 07:00:00,Is the Inflation Battle Won? Not Yet. (Published 2023)
2023-06-22 07:00:00,Why is UK inflation so high and what's core inflation?
2023-06-21 07:00:00,Inflation is as corrosive to investing as it is to the real economy
2023-06-22 07:00:00,Investors must prepare for sustained higher inflation
2023-06-22 07:00:00,Interest rates hiked 50 basis points to 13-year record high of 5%
2023-06-22 07:00:00,‘This is ruining people’s lives’: homeowners hit by UK mortgage crisis speak out
2023-06-22 07:00:00,Bank of England hikes rates to 5% in surprise move to tackle stubborn inflation
2023-06-22 07:00:00,What will higher interest rates mean for car finance customers?
2023-06-21 07:00:00,Warning homeowners face 20% drop in disposable income
2023-06-21 07:00:00,"“It is a real shocker”: UK inflation stays at 8.7%, core inflation highest since 1992"
2023-06-23 07:00:00,Miles apart: The US and Europe diverge on China car threat
2023-06-22 07:00:00,Labour unveils five-point plan for mortgage crisis
2023-06-22 07:00:00,Turkey’s central bank brings low-rate era to close with 6.5 percentage point rise
2023-06-22 07:00:00,Tell us: has your local UK pound shop changed its sign due to inflation?
2023-06-20 07:00:00,Why US inflation will likely fade
2023-06-23 07:00:00,Why can economic forecasts go wrong?
2023-06-20 07:00:00,Why Mark Carney is wrong (again)
2023-06-19 07:00:00,Inflation’s toll: can telcos survive the shake-up?
2023-06-24 07:00:00,Mortgages: how to cope as UK interest rates hit the roof
2023-06-24 07:00:00,The trouble with sticky inflation
2023-06-21 07:00:00,How will higher interest rates impact Spain’s manufacturing sector in 2023?
2023-06-22 07:00:00,Why the Bank of England’s interest rate hikes aren’t slowing inflation enough and what that means for mortgages
2023-06-21 07:00:00,UK inflation rate remains unchanged at 8.7% in May – what it means for you
2023-06-22 07:00:00,Interest rates are hiked AGAIN as BoE fights to curb inflation
2023-06-21 07:00:00,"Mario Draghi says war, inflation ‘didn’t come out of nowhere’"
2023-06-23 07:00:00,C-store expansion boosts Morrisons as inflation hits profits
2023-06-19 07:00:00,Uneven impact of high interest rates: manufacturing struggles while service thrives
2023-06-19 07:00:00,Designing policies with inflation in mind in the Western Balkans
2023-06-20 07:00:00,Will inflation force interest rates and mortgage costs even higher?
2023-06-21 07:00:00,"UK inflation exceeds expectations in May, piling pressure on the government and Bank of England"
2023-06-20 07:00:00,Mortgage cost rises: how other countries compare with the UK
2023-06-23 07:00:00,Breakingviews
2023-06-22 07:00:00,Is it worth buying an index-linked annuity?
2023-06-19 07:00:00,Kazakhstan: Purchasing power cramped by inflation
2023-06-19 07:00:00,Mortgage rates: Average two-year fix now above 6%
2023-06-18 07:00:00,Letter: Wage inflation has uncomfortable echoes of ‘winter of discontent’
2023-06-19 07:00:00,FTSE 100 firm signs for Spinningfields office
2023-06-23 07:00:00,Factors affecting recent food price inflation in the United States
2023-06-20 07:00:00,Global Supply Chain Pressures and U.S. Inflation
2023-06-24 07:00:00,"Inflation is here to stay, says Tesco boss Ken Murphy"
2023-06-20 07:00:00,‘This is not pain – try having a mortgage in the late 1970s’
2023-06-21 07:00:00,"UK inflation remains unchanged at 8.7% in May, upping pressure on Bank of England to raise rates"
2023-06-21 07:00:00,Fed Chair Sees ‘Long Way to Go’ on Inflation Fight (Published 2023)
2023-06-22 07:00:00,Glasgow University School of Law staff warn of grade inflation during boycott
2023-06-23 07:00:00,"With the global economy growing at a moderate pace, inflation will gradually subside"
2023-06-21 07:00:00,UK House Price Index: April 2023
2023-06-23 07:00:00,Beth Rigby podcast: Sir Elton John's husband on his fight to eradicate AIDS; PM's personal pledge to bring down inflation
2023-06-22 07:00:00,"In Turkey, Erdogan Signals Shift to Conventional Economics (Published 2023)"
2023-06-19 07:00:00,The FTSE 100 has stalled. Here are 3 things British investors can do now
2023-06-20 07:00:00,Rent inflation remains on track to slow over the coming year
2023-06-24 07:00:00,What to do if you can't pay your mortgage as rates rise
2023-06-20 07:00:00,Irish central bank hikes core inflation forecasts
2023-06-22 07:00:00,Global pricing power sinks to two-and-a-half year low as higher interest rates take their toll
2023-06-21 07:00:00,Why UK has Western Europe’s highest inflation rates (clue: it's mostly about Brexit)
2023-06-21 07:00:00,Inflation in charts: Sky's Paul Kelso breaks down economic jargon
2023-06-19 07:00:00,"Wages are growing faster than before the pandemic, but have fallen in real terms"
2023-06-22 07:00:00,"There's a 'Brexit element' to UK inflation, economist says"
2023-06-20 07:00:00,"UK grocery inflation edges lower for third straight month, data show"
2023-06-23 21:09:01,We Need To Talk About Inflation
2023-06-19 07:00:00,Exploring US Snacking Trends: Monitoring Inflation and Promotional Impact
2023-06-19 07:00:00,Britain’s Post-Brexit Economy: Navigating Inflation And Recession Threats
2023-06-19 07:00:00,"NSW must help Reserve Bank ‘slay the inflation dragon’, state treasurer says"
2023-06-22 07:00:00,Turkey delivers big rate hike to 15% but U-turn still underwhelms
2023-06-19 07:00:00,"In Argentina, Inflation Passes 100% (and the Restaurants Are Packed) (Published 2023)"
2023-06-22 07:00:00,Supply chains are back to normal. Why is inflation still so high?
2023-06-26 07:00:00,The Effect of Inflation on Mortgages and Mortgage Holders
2023-06-28 07:00:00,"Economic growth, inflation and productivity"
2023-06-27 07:00:00,Bank of England’s quantitative easing scheme let ‘inflation take root’
2023-06-28 07:00:00,FTSE 100 falls flat as UK misses global stock rally
2023-06-29 07:00:00,Interest rate hikes are not the only tool to fight UK inflation – here’s what the government should do
2023-06-27 07:00:00,How house prices respond to interest rates depends on where they are in the country
2023-06-29 07:00:00,Claims inflation and personal injury claims: a global review
2023-06-29 07:00:00,Have changes in UK immigration increased inflation?
2023-06-28 07:00:00,Italy voices anger at ECB interest rate hikes
2023-06-29 07:00:00,Why is luxury outpacing inflation?
2023-06-26 07:00:00,Europe’s Inflation Outlook Depends on How Corporate Profits Absorb Wage Gains
2023-06-25 07:00:00,It’s Brexit that cranks up inflation. Don’t just blame the Bank
2023-06-30 07:00:00,Eurozone inflation falls to 5.5%
2023-06-28 07:00:00,Economic update: How are the Prime Minister’s pledges for the economy going?
2023-06-27 07:00:00,Why are UK telecoms firms imposing inflation-busting bills?
2023-06-29 07:00:00,German inflation surges more than expected to 6.8%
2023-06-27 07:00:00,"Corporate profits drove up prices last year, says ECB president | European Central Bank"
2023-06-25 07:00:00,Governments advised to cut public spending or raise taxes to curb inflation
2023-06-28 07:00:00,Wage rises are driving inflation? Don’t swallow this dangerous rightwing myth
2023-06-25 07:00:00,Union fury as figures show pay rises among top earners driving inflation
2023-06-29 07:00:00,Will giving workers a pay rise really make inflation worse? We asked expert economists
2023-06-25 07:00:00,"Press release: Central banks stay the course as inflation fight gets tougher, BIS says"
2023-06-30 07:00:00,UK economy makes slow start to 2023 as inflation weighs
2023-06-28 07:00:00,Central bank chiefs warn interest rates will keep rising
2023-06-28 07:00:00,Chancellor agrees action plan with regulators to support consumers
2023-06-27 07:00:00,Are ‘dividend hero’ investment trusts keeping up with inflation?
2023-06-28 07:00:00,BoE’s PRA thematic review reveals concerns over general insurance claims inflation
2023-06-29 07:00:00,Emissions and energy impacts of the Inflation Reduction Act
2023-06-30 07:00:00,French Inflation Follows Italy and Spain Down to 14-Month Low
2023-06-29 07:00:00,ECB hawks take aggressive stance on rates after UK inflation wake-up call
2023-06-29 07:00:00,UK Inflation not due to Brexit
2023-06-29 07:00:00,Spanish Inflation Is Now Under 2% ECB Goal at a Two-Year Low
2023-06-30 07:00:00,Concert and festival ticket prices in Europe on the rise
2023-06-26 07:00:00,ECB Forum on Central Banking 2023
2023-06-27 07:00:00,"‘Entrenched inflation’ drives 4mn Nigerians into poverty, says World Bank"
2023-06-26 07:00:00,Banks being slow to pass on savings rates
2023-06-27 07:00:00,Wise shares surge as higher interest rates drive profits
2023-06-30 07:00:00,Euro-Area Core Inflation Quickens Again in Setback for ECB
2023-06-29 07:00:00,UK Water Bills Soar 350% Since Privatization to Double Inflation
2023-06-28 07:00:00,Top Central Bankers Expect More Rate Increases Amid Stubborn Inflation (Published 2023)
2023-06-29 09:40:33,Articles
2023-06-25 07:00:00,Bets on bond renaissance frustrated by stubbornly high inflation
2023-06-26 07:00:00,"Investors overly optimistic on speed, cost of taming inflation, says IMF"
2023-06-28 07:00:00,Why has the price of car insurance gone up so much?
2023-06-29 07:00:00,Europe’s Inflation Issue Moves Into a New Phase: From Profits to Wages (Published 2023)
2023-06-26 07:00:00,The impact of higher rates on infrastructure investments
2023-06-30 07:00:00,Imagine UK inflation if sterling were actually weak
2023-06-27 07:00:00,Inflation Proves Persistent as It Moves Through the Eurozone Economy (Published 2023)
2023-06-28 07:00:00,Global inflation forecasters reflect on a 'humbling task'
2023-06-26 07:00:00,"Media Bites 26 June: Inflation, Carlsberg, Hotel Chocolat"
2023-06-29 07:00:00,Rising Inflation Means British Water Companies Are Leaking Money
2023-06-27 07:00:00,Boots adds to trend for higher high street sales as UK grapples with sticky inflation
2023-06-30 07:00:00,"Eurozone Inflation Slows, but Underlying Price Pressures Persist (Published 2023)"
2023-06-30 07:00:00,High interest rates and the euro area economy
2023-06-26 07:00:00,Three Uncomfortable Truths For Monetary Policy
2023-06-27 07:00:00,Mobile and broadband firms accused of fuelling UK ‘greedflation’ with major price hikes
2023-06-27 07:00:00,Biden kept Trump's tariffs on Chinese imports. This is who pays the price
2023-06-28 07:00:00,What’s been happening in the UK’s housing market in the first half of 2023?
2023-06-29 07:00:00,The 13 FTSE 100 shares behind July’s dividend bonanza
2023-06-29 07:00:00,"US is on track to halve emissions by 2035, but this still isn't enough"
2023-06-28 07:00:00,Have expensive Beyoncé and Taylor Swift tickets driven inflation?
2023-06-29 07:00:00,Month: June 2023
2023-06-29 07:00:00,"Tokyo inflation points to broadening price pressure, tests dovish Bank of Japan stance"
2023-06-30 07:00:00,New World Bank Report Points to Tajikistan’s Potential to Boost Economic Growth by Enhancing the Dynamism of the Private Sector
2023-06-27 07:00:00,Inflation hits ‘flagship’ new road with £24m funding gap
2023-06-29 07:00:00,Construction Inflation: Why doing nothing is not an option
2023-06-28 07:00:00,"Andrew Bailey, Christine Lagarde and Jerome Powell warn inflation fight not yet done"
2023-06-30 07:00:00,What could break as interest rates rise?
2023-06-26 07:00:00,Advisers cautious but focused on protection following further rises to interest rates
2023-06-27 07:00:00,When can we expect food prices to fall? | ITV News
2023-06-27 07:00:00,Which Households Are Most Exposed to the Inflation “Tax”?
2023-06-28 07:00:00,Italy’s Giorgia Meloni rails against further European Central Bank rate rises
2023-06-27 07:00:00,India to extend time-of-use electricity tariffs
2023-06-28 07:00:00,Inflation and interest rates: Ruling class prepares to impose pain
2023-06-26 07:00:00,Pressure on supermarkets to lower prices sends food inflation to new low
2023-06-28 07:00:00,The Neo-Brandeisians Are Wrong About Greedflation
2023-06-30 07:00:00,Persistent UK Inflation Forces the BoE’s Hand– Sterling Update
2023-06-30 07:00:00,Opinion | Interest Rates Cause a Water Crisis
2023-06-27 07:00:00,Inflation hurts. But White House economists find that it’s even worse in every other G7 nation
2023-06-27 07:00:00,Brazil inflation slows as central bank foresees August rate cut
2023-06-29 07:00:00,White House's Brainard sees 'every reason' to believe inflation going down
2023-06-27 07:00:00,Poundland launches £1 own label range to battle brand inflation
2023-06-29 07:00:00,Options for the ECB to Neutralise the Negative Effects of Its Monetary Policy for the European Energy Transition
2023-06-28 07:00:00,Argentina inflation leaves London restaurant eating its losses
2023-06-29 07:00:00,Italy may have dodged a ‘pasta strike’ but food inflation is still high. Here’s why
2023-06-27 07:00:00,"Canada's May inflation rate slows, weakening case for a July rate hike"
2023-06-25 07:00:00,I. Navigating the disinflation journey
2023-06-28 07:00:00,The loan sharks profiting from the pain of soaring prices
2023-06-26 07:00:00,"ECB and Peers Must Raise Interest Rates Further, IMF’s Gita Gopinath Says"
2023-06-29 07:00:00,Inflation hits royal finances as King Charles turns down heating to save emissions
2023-06-27 07:00:00,Ian McConnell: This pathetic Tory superiority is beyond parody
2023-06-28 07:00:00,How AI can help businesses circumvent inflation
2023-06-26 18:01:39,Limited company buy to let mortgage calculator
2023-06-28 07:00:00,Italy’s Inflation Rate at 14-Month Low Offers Limited Comfort to ECB
2023-06-26 07:00:00,"Corporate profits were biggest driver of inflation in Europe, IMF admits"
2023-06-30 07:00:00,"Emerging markets carry investor hopes for H2 on lower inflation, rates"
2023-06-26 07:00:00,Indonesia Economic Prospects (IEP) June 2023: The Invisible Toll of Covid-19 on Learning
2023-06-25 07:00:00,Rishi Sunak attempts to slay the inflation Jabberwock – cartoon | Chris Riddell
2023-06-28 07:00:00,"(PDF) The Impact of Inflation on Poverty, Food & Nutrition Security"
2023-06-30 07:00:00,Children and the Cost-of-living Crisis
2023-07-03 07:00:00,Why are interest rate rises not taming inflation?
2023-07-02 07:00:00,Using austerity economics to crush UK inflation would be a cure worse than the disease
2023-07-03 07:00:00,Unfriendly friends: Trade and relocation effects of the US Inflation Reduction Act
2023-07-05 07:00:00,Economists draw swords over how to fix inflation
2023-07-07 07:00:00,Firm inflation perceptions and expectations: evidence from the Decision Maker Panel
2023-07-07 07:00:00,"Ofgem asks energy firms to publish all tariffs, after Martin Lewis letter"
2023-07-06 07:00:00,"Cost of living: Governor of the Bank of England, Andrew Bailey, talks about inflation, interest rates and how it impacts young people"
2023-07-05 07:00:00,Historic inflation calculator: How money's value changed since 1900
2023-07-03 07:00:00,Apple Costs More Than the FTSE 100
2023-07-06 07:00:00,Labour costs keep inflation elevated worldwide in June
2023-07-05 07:00:00,Ex-officials say Bank of England was too slow to heed inflation warnings
2023-07-04 07:00:00,How are inflation and rising interest rates impacting insurers and asset managers?
2023-07-06 07:00:00,FTSE 100 falls to lowest closing level in 2023 as interest rate fears grip markets
2023-07-07 07:00:00,Who pays for the tariffs and why: The asymmetric tariff pass-through between China and the US
2023-07-04 07:00:00,US audit fees that lag inflation squeeze accountants
2023-07-06 07:00:00,"NatWest, Lloyds, Barclays and HSBC among banks quizzed over savings rates"
2023-07-04 07:00:00,"Food inflation starting to fall, says Sainsbury’s as sales rise"
2023-07-08 07:00:00,Economist Kate Barker: ‘To tackle inflation we should put taxes up for the better-off’
2023-07-05 07:00:00,"Stubborn UK inflation may lead to 7% interest rates, economists warn"
2023-07-03 07:00:00,Sainsbury’s says food inflation ‘starting to fall’ as sales rise
2023-07-05 07:00:00,It’s a World of Inflation (Published 2023)
2023-07-05 07:00:00,How do wage changes factor into the cost of living crisis across the country?
2023-07-03 07:00:00,UK balance sheets: The link between interest rates and deposits
2023-07-04 07:00:00,"Sainsbury’s has ‘zero complacency’ on food inflation, says CEO Simon Roberts"
2023-07-06 07:00:00,Where Is Inflation Persistence Coming From?
2023-07-06 07:00:00,2023 News items
2023-07-03 07:00:00,Corporate profits responsible for almost half of Europe’s inflation: IMF report
2023-07-03 07:00:00,"At the Front Lines of the Inflation Fight, Uncertainty Reigns (Published 2023)"
2023-07-04 07:00:00,What are the Main Issues Facing the UK Economy?
2023-07-04 07:00:00,Bank bosses told to explain low savings rates
2023-07-03 07:00:00,"Rising Oil Prices, Loose Monetary Policy, and US Inflation"
2023-07-03 07:00:00,How ballooning global debt and hiked interest rates are affecting developing countries
2023-07-06 07:00:00,High jewellery houses benefit from buyers undeterred by inflation
2023-07-07 07:00:00,Prices of concerts and festival tickets in Europe on the rise
2023-07-04 07:00:00,"Higher wages to temper UK food inflation fall, says Sainsbury's boss"
2023-07-05 07:00:00,Income to house price ratio more than doubles since the 70s
2023-07-03 07:00:00,"Swiss inflation dips to 1.7% in June, but rate hike still expected"
2023-07-03 07:00:00,Fresh hope on inflation as manufacturing input costs fall at fastest pace since 2016
2023-07-06 07:00:00,FTSE 100 Analysis: Blue-chips sink to 3-month low – Top UK stocks
2023-07-04 07:00:00,Why are Virgin Media and BT so quiet about broadband ‘social tariffs’?
2023-07-03 07:00:00,"Brazil economists foresee deeper monetary easing, lower inflation"
2023-07-03 07:00:00,FTSE 100 slips into the red after AstraZeneca shares slump
2023-07-05 07:00:00,Latin America’s bonds and currencies lure yield-hungry investors
2023-07-02 07:00:00,Africa Becomes A Casualty In The War Against Inflation As Dollars Dry Up
2023-07-06 07:00:00,"Argentina to hold interest rate at 97% as raging inflation eases, bank sources say"
2023-07-03 07:00:00,Fortnite blames UK V-Bucks price hike on inflation
2023-07-04 07:00:00,Quotas make a comeback in US trade policy | Articles
2023-07-03 07:00:00,RBA interest rates: will the Greedflation Godzilla get any credit?
2023-07-04 07:00:00,Inflation was high in 2022. Here’s why.
2023-07-03 07:00:00,Roy Cropper’s pie and chips prices show the real impact of inflation
2023-07-05 07:00:00,"Childcare fees in Australia outpace inflation with rises of up to 32%, report finds"
2023-07-06 07:00:00,SRA increases SQE exam fees by 11% in response to inflation
2023-07-06 07:00:00,"Hopes of political change, surging inflation lure hedge funds to Argentinian stocks"
2023-07-05 07:00:00,"Philippine inflation slows in June, supports extended rate pause"
2023-07-05 07:00:00,Bank bosses to explain poor interest rate rises for savers as firms across East of England squeezed
2023-07-08 07:00:00,Interest rates are 5%. Should I dump dividend stocks and put money into savings accounts?
2023-07-02 07:00:00,Indonesia's June inflation eases to lowest in 14 months
2023-07-07 07:00:00,How do Rising Interest Rates Affect the Stock Market?
2023-07-07 07:00:00,The June Payrolls Report Probably Doesn’t Change Much for the Fed (Published 2023)
2023-07-06 07:00:00,"'Big Short' Burry Called Inflation, Still Waiting for Crash, Recession"
2023-07-05 07:00:00,Why Wimbledon’s strawberries are immune to inflation
2023-07-08 07:00:00,"­If you think inflation in the US is high, look at the numbers in these countries"
2023-07-05 07:00:00,"Pricing practices and operating costs of childcare services to be examined, as latest ACCC report confirms fees outpaced inflation"
2023-07-05 09:05:00,Let's Make an Inflation Reduction Act Deal
2023-07-06 07:00:00,It's not just the US: Corporate profits are keeping inflation high in Europe too
2023-07-06 07:00:00,Financial watchdog to discuss savings rates concerns with bank chiefs
2023-07-04 07:00:00,"Statement by Philip Lowe, Governor: Monetary Policy Decision"
2023-07-04 07:00:00,The RBA has kept interest rates on hold. Here's why it'll be cautious from here on
2023-07-04 07:00:00,0704 Written Answer to PQ on CPF Interest Rates
2023-07-13 07:00:00,Unknown measures: assessing uncertainty around UK inflation using a new Inflation-at-Risk model
2023-07-13 07:00:00,Public sector pay: Will rises for doctors and teachers cause inflation?
2023-07-12 07:00:00,"US inflation rate down to 3% in June, a two-year low, but prices remain high"
2023-07-11 07:00:00,Record pay rises fuel fresh inflation fears
2023-07-14 07:00:00,EU records highest level of inflation since euro introduction: 96.5 million people at risk of poverty
2023-07-12 07:00:00,Why we now need above inflation rate pay rises – and why they are not inflationary
2023-07-13 07:00:00,Inflating away the debt: The debt-inflation channel of German hyperinflation
2023-07-12 07:00:00,How AI’s astonishing productivity gains could help curb inflation
2023-07-11 07:00:00,The House Article | Inflation is a profound evil – getting it under control is vital
2023-07-13 07:00:00,"William Davies · Pain, No Gain: Inflation Fixation"
2023-07-13 07:00:00,"UK food price inflation to be 9% in December, industry researcher cautions"
2023-07-10 07:00:00,The algorithms quietly stoking inflation
2023-07-10 09:44:36,Inflation woes will hang over our heads for a long time
2023-07-13 07:00:00,What seven charts tell us about UK retail sales post-COVID and inflation
2023-07-10 07:00:00,Will higher interest rates make industries more competitive?
2023-07-13 07:00:00,Which G7 Economies Have the Highest Inflation?
2023-07-12 07:00:00,Financial Stability Report
