date,title
2025-05-13 01:52:30,Weekly market commentary - blackrock.com
2025-04-28 07:00:00,Will the Bank of England Cut Interest Rates in May? - Morningstar
2025-03-26 07:00:00,Economic and fiscal outlook – March 2025 - Office for Budget Responsibility
2025-04-27 07:00:00,The Impact of an Inverted Yield Curve - Investopedia
2025-04-07 07:00:00,Indian Financial Markets – an Inflection point in their global role? - LSEG
2025-05-14 18:51:52,Labour 7 Statement to G7 Finance Ministers and Central Bank Governors - Canadian Labour Congress
2025-04-19 07:00:00,US bond markets: Why everyone is watching them closely - BBC
2025-01-21 08:00:00,"Trump’s second term – what’s next for stocks, bonds, gold, interest rates and oil prices? - Hargreaves Lansdown"
2024-09-10 07:00:00,The UK economy in the 1990s - House of Lords Library
2024-08-26 07:00:00,"As US rate cuts near, economic 'soft-landing' odds could dictate stock performance - Reuters"
2024-10-30 07:00:00,Economic and fiscal outlook – October 2024 - Office for Budget Responsibility
2025-04-07 07:00:00,Will the Bank of England Cut Interest Rates After Trump Tariff Turmoil? - Morningstar
2025-01-27 08:00:00,Will the Bank of England Cut Interest Rates on Feb. 6? - Morningstar
2025-03-12 07:00:00,Will the Bank of England Cut Interest Rates in March? - Morningstar
2025-04-25 07:00:00,Germany Battles Recession and Tariffs: What This Means for Investors - Morningstar
2025-02-06 08:00:00,Bank of England Makes Third Rate Cut in Six Months - Morningstar
2025-04-11 07:00:00,Will the ECB Cut Interest Rates Amid Trade Tariff Turmoil? - Morningstar
2025-03-06 08:00:00,ECB Cuts Rates and Warns of Trade War Risks - Morningstar
2025-03-05 08:00:00,Top FTSE 100 UK Dividend Paying Stocks - Morningstar
2025-01-20 08:00:00,How Many Times Will the ECB Cut Interest Rates in 2025? - Morningstar
2025-01-13 08:00:00,UK Government Bond Turmoil: What It Means - Morningstar
2025-04-24 07:00:00,"Great Depression | Definition, History, Dates, Causes, Effects, & Facts - Britannica"
2024-06-27 07:00:00,Financial Stability Report - June 2024 - Bank of England
2025-03-19 07:00:00,What Is the Relationship Between Inflation and Interest Rates? - Investopedia
2025-04-09 07:00:00,Trump tariffs spark US government debt sell-off - BBC
2024-08-02 07:00:00,BoE rate cut adds to sense of turnaround in sluggish UK economy - Reuters
2024-11-21 08:00:00,Fixed Income: The argument for investing in bonds is the strongest it has been in years says Invesco's FI team - IFA Magazine
2024-11-21 08:00:00,The Stock Market Crash of 2008 - Investopedia
2024-12-19 08:00:00,The Stock Market Crash of 1929 and the Great Depression - Investopedia
2025-05-08 14:01:47,Financial Stability Report—2025 - Bank of Canada
2024-11-25 08:00:00,Our economic and market outlook for 2025: Global summary - corporate.vanguard.com
2025-03-31 07:00:00,What Happened to Silicon Valley Bank? - Investopedia
2024-08-08 07:00:00,The Fed has cut rates amid stock swoons before. Not this time - Reuters
2025-05-14 13:30:08,Home loan interest rates drop up to 7.8%. Check how bank stocks have fared amid RBI rate cut - The Economic Times
2024-07-03 07:00:00,Brave new “fiscal” world? - Macquarie
2024-12-12 08:00:00,China's bond market sees more economic pain ahead - Reuters
2024-09-27 07:00:00,China launches late stimulus push to meet 2024 growth target - Reuters
2025-02-23 08:00:00,Monetary Policy and Inflation - Investopedia
2024-03-06 08:00:00,Economic and fiscal outlook – March 2024 - Office for Budget Responsibility
2024-07-22 07:00:00,China cuts several major interest rates to support fragile economy - Reuters
2025-01-16 08:00:00,How bond market vigilantes could check Trump's power - Reuters
2025-02-03 08:00:00,Understanding quantitative easing - Bank of Canada
2024-11-06 08:00:00,"BOJ saw positive economic signs even as it signaled pause, Sept minutes show - Reuters"
2025-01-10 08:00:00,China’s Central Bank Stops Buying Bonds as Deflation Fears Grip Economy - The New York Times
2024-06-17 07:00:00,"What Is the Risk-Free Rate of Return, and Does It Really Exist? - Investopedia"
2024-06-19 07:00:00,10-Year Treasury Bond Yield: What It Is and Why It Matters - Investopedia
2024-11-15 08:00:00,Trump's economic agenda faces a big potential foe: The bond vigilantes - NPR
2025-03-14 07:00:00,Why lowering the yield on 10-year bonds is more important to Trump than the stock market or interest rates - Fortune
2024-05-23 13:24:44,How a UK recession affects mortgages and interest rates - The Times
2023-12-06 08:00:00,Financial Stability Report - December 2023 - Bank of England
2020-03-11 07:00:00,Bank of England measures to respond to the economic shock from Covid-19 - Bank of England
2023-09-04 07:00:00,Why did the global financial crisis of 2007-09 happen? - Economics Observatory
2022-05-24 09:15:59,GDP and events in history: how the COVID-19 pandemic shocked the UK economy - Office for National Statistics
2021-12-13 08:00:00,Financial Stability Report - December 2021 - Bank of England
2023-12-08 08:00:00,The UK economy in the 1950s - House of Lords Library
2021-11-11 08:00:00,Quantitative easing - House of Lords Library
2023-06-27 20:33:26,What did the Fed do in response to the COVID-19 crisis? - Brookings
2024-03-25 20:44:57,Monetary policy and inequality - European Central Bank
2021-03-25 02:37:46,Analysing the impact of quantitative easing on the UK economy after the financial crisis - University of Bath
2025-01-07 08:00:00,"2025 Canadian Bond Outlook: Attractive Yields, but Uncertainty Reigns - Morningstar"
2024-05-16 08:02:07,"Financial Stability Review, May 2024 - European Central Bank"
2022-09-28 07:00:00,Bank of England Intervenes in 'Dysfunctional' Bond Market - Morningstar
2018-10-03 07:00:00,Lasting Effects: The Global Economic Recovery 10 Years After the Crisis - International Monetary Fund
2015-01-09 08:00:00,2014: Our Top Observations in the Global Fixed Income Markets - Tradeweb Markets
2024-04-16 07:00:00,Central Banks Must Remain Vigilant Along the Last Mile of Disinflation - International Monetary Fund
2015-03-20 07:10:33,Global Economic Prospects - World Bank
2024-01-31 08:00:00,Emerging Markets Navigate Global Interest Rate Volatility - International Monetary Fund
2024-01-04 08:00:00,Strangulation not suffocation - Macquarie
2022-01-23 08:00:00,Explainer: Lebanon's financial crisis and how it happened - Reuters
2022-02-01 08:00:00,CAF Issued USD 650 Million in Bonds to Support Latin American and Caribbean Economic and Social Recovery - CAF -banco de desarrollo de América Latina
2017-03-25 23:26:01,Quantitative Easing (QE): What It Is and How It Works - Investopedia
2022-10-26 23:13:59,Inflation: Prices on the Rise - International Monetary Fund
2024-04-18 07:00:00,Financial System Report (April 2024) - boj.or.jp
2022-02-01 08:00:00,CAF issued USD 650 million in bonds to support Latin American and Caribbean economic and social recovery - CAF -banco de desarrollo de América Latina
2022-10-27 09:03:53,Fiscal Policy: Taking and Giving Away - International Monetary Fund
2017-03-25 23:01:07,What Happens to Interest Rates During a Recession? - Investopedia
2024-05-03 07:00:00,Quantitative Tightening (QT) - Investopedia
2017-03-25 20:15:13,How Interest Rates Affect the U.S. Markets - Investopedia
2017-03-25 20:32:27,How Do Interest Rates Affect the Stock Market? - Investopedia
2023-04-17 07:00:00,Ranked: The largest bond markets in the world - The World Economic Forum
2024-05-01 07:00:00,"Fed leaves rates unchanged, flags 'lack of further progress' on inflation - Reuters"
2017-11-07 19:36:36,"Recession: Definition, Causes, Examples and FAQs - Investopedia"
2017-03-26 05:10:32,Great Recession: What It Was and What Caused It - Investopedia
2014-02-18 08:00:00,Economy tracker: Interest rates - BBC
2017-03-25 23:21:53,"Liquidity Trap: Definition, Causes, and Examples - Investopedia"
2017-03-26 00:36:03,Yield Curve: What It Is and How to Use It - Investopedia
2017-03-26 00:59:18,5 Things You Shouldn’t Do During a Recession - Investopedia
2017-03-25 18:44:29,How National Interest Rates Affect Currency Values and Exchange Rates - Investopedia
2018-07-02 14:23:27,Causes of the Great Depression - Britannica
2017-03-25 09:07:47,Inflation’s Impact on Stock Returns - Investopedia
2017-03-25 19:26:18,What Causes a Bond's Price to Rise? - Investopedia
2017-03-25 18:20:28,How to Profit From Inflation - Investopedia
2014-09-26 05:30:26,"Indonesia Overview: Development news, research, data - World Bank"
2017-03-26 00:24:51,Expansionary Fiscal Policy: Risks and Examples - Investopedia
2017-03-25 07:43:04,Monetary Policy vs. Fiscal Policy: What's the Difference? - Investopedia
2017-03-27 22:00:50,Understanding Purchasing Power and the Consumer Price Index - Investopedia
2017-03-25 09:28:09,Bonds: Treasury Yields and Interest Rates - Investopedia
2017-07-30 16:38:07,Collateralized Debt Obligation (CDO): What It Is and How It Works - Investopedia
2017-03-24 21:25:35,What Is Zero Interest-Rate Policy (ZIRP)? How It Works and Goals - Investopedia
2017-03-25 22:12:22,The Fed's Tools for Influencing the Economy - Investopedia
