date,title
2023-01-04 08:00:00,Our Inflation Outlook in 5 Charts
2023-01-05 08:00:00,Record 13.3% UK food inflation raises fears of ‘another difficult year’ | UK cost of living crisis
2023-01-04 08:00:00,Rishi Sunak says public sector pay rises will fuel inflation. Economists say they won't
2023-01-03 08:00:00,The Well‐Being Cost of Inflation Inequalities
2023-01-05 08:00:00,Russia’s war brings runaway inflation to Kazakhstan
2023-01-05 08:00:00,Equities suffered brutal year as inflation fight raged
2023-01-07 08:00:00,"Supply chains, trade, and inflation"
2023-01-05 08:00:00,Chart of the week: Peak inflation?
2023-01-03 08:00:00,Can the Inflation Reduction Act unlock a green hydrogen economy?
2023-01-05 08:00:00,Why neutral rates have risen and why it matters
2023-01-05 08:00:00,Big Short’s Michael Burry calls second ‘inflation spike’
2023-01-02 08:00:00,"Economic Crisis, Inflation and Poverty in Sri Lanka"
2023-01-04 08:00:00,Inflation can help with government debt. But bond investors will lose out
2023-01-03 08:00:00,How Consumers and Businesses are Reacting to Food Price Inflation
2023-01-03 08:00:00,Global economy 2023: Why central banks face an epic battle against inflation amid political obstacles
2023-01-03 08:00:00,"World Economic Situation and Prospects: January 2023 Briefing, No. 168"
2023-01-06 08:00:00,Inflation will tumble in 2023. Deflation is possible in 2024. And none of that is down to any government policy or action.
2023-01-03 08:00:00,Turkish inflation falls more than expected on lower fuel costs
2023-01-04 08:00:00,"Apple's value drops as interest rates, supply woes and recession fears batter tech industry"
2023-01-05 08:00:00,"UK businesses cut investment as interest rates rise, BoE survey finds"
2023-01-04 08:00:00,UK food inflation hits 13.3% in December
2023-01-05 08:00:00,Spain slashes VAT on food products to help mitigate inflation
2023-01-04 08:00:00,UK grocery price inflation fuels first ever £12 billion Christmas
2023-01-03 08:00:00,Adjusting for Inflation
2023-01-05 08:00:00,When wage inflation is good for you
2023-01-01 08:00:00,NHS unions say plans for 2% pay rise next year could mean more strikes
2023-01-04 08:00:00,US inflation: How much have prices increased?
2023-01-01 08:00:00,"Gas prices, interest rates, NHS waiting lists"
2023-01-05 08:00:00,The Layers of Inflation Persistence
2023-01-05 08:00:00,"The Meal Deal Inflation Index: Tesco, Sainsbury's, Boots and more, tracked"
2023-01-04 08:00:00,"Sunak Pledges to Cut Debt, Halve Inflation in Crisis-Hit UK"
2023-01-03 08:00:00,Opinion | The Football Game Theory of Inflation (Published 2023)
2023-01-04 08:00:00,"PM's five pledges for Britain: Halve inflation, grow economy, slash debt, cut NHS waits and tackle channel migrants"
2023-01-06 08:00:00,BlackRock says we’re all doomed. It’s being optimistic
2023-01-06 08:00:00,Tunisia inflation rate jumps to 10.1 percent in December
2023-01-04 08:00:00,"FOMC in Dec worried about ""misperception"" that inflation fight flagging"
2023-01-04 08:00:00,Inflation vow realistic ‘due to economic factors rather than political measures’
2023-01-03 08:00:00,The analysis of credit card data can shed new light on the effects of monetary policy
2023-01-04 08:00:00,Crispin Odey’s hedge fund enjoys record year thanks to bet on inflation
2023-01-03 08:00:00,Aldi boosted by inflation and store openings
2023-01-06 08:00:00,Inflation will have the biggest negative impact on pharma industry in 2023: survey
2023-01-03 08:00:00,Nurses have asked for a pay rise of RPI inflation plus 5%
2023-01-06 08:00:00,UK house prices drop for fourth month in a row
2023-01-06 08:00:00,Brompton’s profits plunge as inflation and supply chain pressures take toll
2023-01-04 08:00:00,Rishi Sunak's five promises analysed
2023-01-04 08:00:00,Surprise French inflation drop adds to signs Europe prices are cooling
2023-01-04 08:00:00,Bargain of 2022: Getir ‘rolls back prices to the 90s’ to fight inflation
2023-01-06 08:00:00,Inflation prompts Greggs to increase workers’ pay by 10%
2023-01-05 08:00:00,Managing consumer and media inflation in 2023
2023-01-05 08:00:00,#studentviews: How is China’s lockdown policy affecting the world economy?
2023-01-02 08:00:00,"Third of world in recession this year, IMF head warns"
2023-01-04 08:00:00,"Why We Missed On Inflation, and Implications for Monetary Policy Going Forward"
2023-01-02 08:00:00,"UK faces worst and longest recession in G7, say economists"
2023-01-05 08:00:00,Greggs workers get 10% pay increase amid ‘material cost inflation’
2023-01-03 08:00:00,German inflation slows in December on one-off energy payment
2023-01-02 08:00:00,"Pakistan Inflation Hardens in December On Food, Fuel Costs"
2023-01-03 08:00:00,Fed tightens money supply as US inflation falls from 2022 peak
2023-01-06 08:00:00,Oil price flip highlights Fed's inflation base effect jam
2023-01-01 08:00:00,The Inflation Reduction Act’s energy- and climate-related tax provisions
2023-01-04 08:00:00,Interest rates: What to expect from the Bank of England in 2023?
2023-01-03 08:00:00,Malta has one of the lowest inflation rates in the eurozone
2023-01-05 08:00:00,Global economy 2023: how countries around the world are tackling the cost of living crisis
2023-01-03 08:00:00,Independent academics announce annual inflation rate as 137 percent
2023-01-03 08:00:00,Fed Chair Powell’s Story about Service Price Inflation Is Untrue
2023-01-04 08:00:00,Global hedge funds plan 2023 around inflation risk
2023-01-05 08:00:00,"Venezuela inflation accelerating, heightening risk of return to hyperinflation, economists say"
2023-01-04 08:00:00,"Fed wants 'flexibility' on rates as inflation remains key focus, minutes show"
2023-01-02 06:29:58,Institutional Investor Study Shows Risk Taking Rises with Inflation Expectations
2023-01-04 08:00:00,BP raises oil investments in the U.S. as inflation hits
2023-01-04 08:00:00,Christmas food spending highest on record as inflation bites
2023-01-06 08:00:00,European inflation slows but cost of living remains high
2023-01-05 08:00:00,Inflation Threatens a French Institution: Baguettes
2023-01-05 08:00:00,Allocating Capital When Interest Rates Are High
2023-01-04 08:00:00,"U.S. inflation has not 'turned the corner yet', IMF's Gopinath warns -FT"
2023-01-01 08:00:00,"Interview: U.S. inflation reduction act against WTO rules, fair competition: S. Korean expert"
2023-01-06 08:00:00,Repositioning commercial P&C underwriting for market uncertainties
2023-01-06 08:00:00,Estonia’s inflation still among the fastest in the eurozone in December
2023-01-04 08:00:00,"Esmond Birnie: With strikes, inflation and a fuel crisis the UK in 2023 is looking like it did economically in 1973"
2023-01-05 08:00:00,"Inflation, drug pricing and reimbursement constraints will challenge pharma sector"
2023-01-03 08:00:00,"German inflation hits 7.9% in 2022, highest in over 70 years"
2023-01-03 08:00:00,"Average annual consumer confidence at record low, December consumer confidence remains depressed amidst The Fed’s war on inflation"
2023-01-04 08:00:00,"UK Prime Minister Rishi Sunak vows to halve inflation, tackle illegal immigration"
2023-01-05 08:00:00,Tunisia's annual inflation rate soars to 10.1% in December
2023-01-05 08:00:00,Cardi B’s NSFW advice on inflation
2023-01-03 08:00:00,Argentine artist paints on inflation-hit bank notes
2023-01-04 08:00:00,Average headline inflation in 2022 was the highest in 24 years
2023-01-05 08:00:00,French top-up health insurance tariffs to rise by 4.7% this year
2023-01-05 08:00:00,How the Inflation Reduction Act Will Save Households Money in 2023
2023-01-05 08:00:00,"Grim prospects for UK construction in 2023, warns Glenigan"
2023-01-03 08:00:00,Inflation could sap infrastructure act’s buying power this year
2023-01-04 08:00:00,The Inflation Numbers Game
2023-01-04 08:00:00,Why the £7 Lurpak is here to stay as high food prices become the new normal
2023-01-06 08:00:00,Labour set for inflation windfall with £700k boost to £7m taxpayer funding
2023-01-05 08:00:00,Train drivers' pay has risen by up to 62% in recent years... more than double the rate of inflation
2023-01-01 08:00:00,Brazil’s third-time president Lula has new economic problems
2023-01-03 08:00:00,"Pakistan registers record inflation, struggles with high prices"
2023-01-01 08:00:00,Inflation Reduction Act includes 15% corporate minimum tax on book income
2023-01-05 08:00:00,Two Percent Inflation Targeting Harms Growth
2023-01-07 08:00:00,2022 was the worst-ever year for U.S. bonds. How to position your portfolio for 2023
2023-01-07 08:00:00,High Food Prices Rile Up Canadians (Published 2023)
2023-01-12 08:00:00,What does the rise in the inflation mean for financial stability?
2023-01-12 08:00:00,Does easing US inflation point the way for the world?
2023-01-13 08:00:00,Topics
2023-01-09 08:00:00,"Three forces shaping growth, inflation, and markets in 2023"
2023-01-12 08:00:00,US prices drop for first time since May 2020 as inflation rate falls to 6.5%
2023-01-09 08:00:00,Central banks can’t win when it comes to credibility on inflation
2023-01-11 08:00:00,What has happened to teacher pay in England?
2023-01-10 08:00:00,High inflation disproportionately hurts low-income households
2023-01-13 08:00:00,The Fed
2023-01-11 08:00:00,Ghana Inflation Hits Record 54.1% as Food Costs Surge
2023-01-14 08:00:00,Archived News: Below-inflation rent rise proposed
2023-01-13 08:00:00,Addressing inflationary pressure on construction contracts
2023-01-11 08:00:00,Inflation Is About Class Struggle
2023-01-12 08:00:00,Here's the inflation breakdown for December 2022 — in one chart
2023-01-09 08:00:00,Precious metals outlook hinges on the interplay between inflation and monetary policy
2023-01-12 08:00:00,Seven ways to tackle inflation without raising interest rates
2023-01-11 08:00:00,Large real cuts to student financial support to become permanent
2023-01-12 08:00:00,CPI: US inflation falls to lowest in more than a year
2023-01-10 08:00:00,"‘It’s going to be tough’: Sainsbury’s chief on price cuts, inflation and energy costs"
2023-01-09 08:00:00,Energy crisis and inflation help push Austrians towards far right
2023-01-10 08:00:00,FTSE 100 closes in the red for first time this year
2023-01-12 08:00:00,What’s in store for the UK in 2023? Here’s one economist’s view
2023-01-10 08:00:00,"Brazil's 2022 inflation slows sharply, misses government target"
2023-01-11 08:00:00,"Only Softer Core Inflation Can Shift ECB on Rates, Holzmann Says"
2023-01-12 08:00:00,How to Deal With ‘Inflation Creep’
2023-01-09 08:00:00,Asylum Support Is Not Enough
2023-01-10 08:00:00,Global recession warning as World Bank cuts economic forecast
2023-01-11 08:00:00,"Ghana inflation hits 54% in December, a 22-year high"
2023-01-12 08:00:00,The Many Interest Rates in 2022
2023-01-13 08:00:00,Big Mac Index Shows Official CPI Under Reports Inflation (2022)
2023-01-13 08:00:00,"Argentina's inflation rate at 95%, highest since 1991"
2023-01-11 08:00:00,Uniqlo: Fashion giant to raise pay in Japan by up to 40%
2023-01-13 08:00:00,"School lunch, eggs and airfare: Why inflation soared for 10 items in 2022"
2023-01-10 08:00:00,Revenue Growth Management Helps CPGs Battle Inflation
2023-01-14 08:00:00,Inflation Melts: The Evidence And Implications
2023-01-09 08:00:00,Japan: A modest recovery will continue to be supported by accommodative macro policies
2023-01-10 08:00:00,Watching Services Inflation in 2023
2023-01-09 08:00:00,2 FTSE 100 shares topping my buy list right now!
2023-01-10 08:00:00,Inflation hits plans for Yorkshire’s tallest tower
2023-01-09 08:00:00,South Korea: Recovery from recession will only come later in the year
2023-01-12 08:00:00,India retail inflation within RBI target zone for 2nd month
2023-01-10 08:00:00,President warns of ‘difficult’ times as inflation rises in Egypt
2023-01-11 08:00:00,NBU 2022 Inflation Update
2023-01-12 08:00:00,"Inflation Is Slowing, Good News for American Consumers and the Fed (Published 2023)"
2023-01-12 08:00:00,Cost of living: Argentina sees prices almost doubling last year
2023-01-11 08:00:00,Elevated Inflation Raises Risk of Fiscal Stress for States
2023-01-13 08:00:00,How long will inflation in the UK last?
2023-01-10 08:00:00,Belgium accuses US of ‘aggressive’ push to lure European business
2023-01-13 08:00:00,Inflation hits London barber shops with the £10-plus haircut
2023-01-12 08:00:00,How Much Have Record Corporate Profits Contributed to Recent Inflation?
2023-01-11 08:00:00,UK-based Cooplands sees annual sales rise but inflation bites profits
2023-01-12 08:00:00,Inflation bites: How rising food costs affect nutrition and health
2023-01-12 08:00:00,Argentina Inflation Hit Three-Decade High of 95% in 2022
2023-01-10 08:00:00,"Inflation in Egypt continues to skyrocket, leaving citizens struggling to buy basics"
2023-01-12 08:00:00,What Moves Gold Prices?
2023-01-12 08:00:00,"US Inflation Cools Again, Putting Fed on Track to Downshift"
2023-01-12 08:00:00,"Inflation is easing, even if it may not feel that way"
2023-01-12 08:00:00,Inflation report is a mixed bag – an economist explains why some items are rising faster than others
2023-01-12 08:00:00,Euro US Dollar (EUR/USD) Exchange Rate Soars as US Inflation Falls
2023-01-11 08:00:00,Manufacturer Strategies to Mitigate Inflation in African Soft Drinks Market
2023-01-10 08:00:00,See the economies behind the levies | Infographic
2023-01-13 08:00:00,Swedish Inflation Tops 10% for the First Time Since 1991
2023-01-13 08:00:00,How I identified this dirt-cheap FTSE 100 stock
2023-01-12 08:00:00,3 charts that explain what’s happening with US inflation
2023-01-12 08:00:00,"Inflation may not have peaked yet, warns Tesco boss"
2023-01-13 08:00:00,Exclusive: City asset finance chief on how to stay calm amid eye-watering inflation
2023-01-12 08:00:00,2022 Inflation Tops Previous Decades
2023-01-09 08:00:00,Bloor posts 21% increase in profit citing inflation boost
2023-01-08 08:00:00,"Explainer: How strained China-Australia relations hit trade in coal, barley, beef and wine"
2023-01-09 08:00:00,Global Central Banks Aren’t Declaring Victory Over Inflation Yet
2023-01-10 08:00:00,"Powell: Fed needs independence to fight inflation, should avoid social policy"
2023-01-13 08:00:00,Two Indicators: The 2% inflation target : Planet Money
2023-01-12 08:00:00,What is ‘supercore’ inflation? Economists are obsessing over a narrow slice of price data
2023-01-08 08:00:00,The US should break up monopolies – not punish working Americans for rising prices | Robert Reich
2023-01-09 08:00:00,Consumer inflation in Japan's capital exceeds BOJ target for 7th month
2023-01-13 08:00:00,Wall Street mixed as FTSE 100 touches four-year high
2023-01-09 08:00:00,Trade Of The Week: Gold Eyes Key US Inflation Data
2023-01-09 08:00:00,9 Expert-Approved Ways to Save Money During Inflation
2023-01-11 08:00:00,"Supply Shocks, Inflation, and the Limits of Monetary Policy"
2023-01-09 08:00:00,Political party affiliation and inflation expectations
2023-01-12 08:00:00,Inflation hits record high in Ghana
2023-01-12 08:00:00,"Consumer prices fell 0.1% in December, in line with expectations from economists"
2023-01-12 08:00:00,The Insightful Leader Live: The Latest on Inflation and the Economy
2023-01-09 08:00:00,Gold Market Commentary
2023-01-13 08:00:00,Pension reform in France: Bonjour tristesse
2023-01-10 08:00:00,Inflation fighting central bankers air climate role doubts
2023-01-08 08:00:00,The rising cost of cycling — when will this crisis stop!?
2023-01-11 08:00:00,China consumer inflation accelerates in Dec; PPI falls with soft demand
2023-01-12 08:00:00,Martin Lewis: Students in England ‘dealt a blow’ as Government plans to increase maintenance loans by just 2.8%
2023-01-10 08:00:00,Ranked: Harmful Tariffs by Economy
2023-01-11 08:00:00,Uniqlo owner tries to make working in retail attractive with raises of up to 40% as Japan's inflation soars
2023-01-12 08:00:00,U.S. Inflation Slowed for Sixth Straight Month in December
2023-01-12 08:00:00,Inflation Falls for 6th Straight Month. It's Positive for the Fed.
2023-01-11 08:00:00,"Global Economics Intelligence executive summary, December 2022"
2023-01-12 08:00:00,"Bank of Korea raises interest rates, hints they will now be steady"
2023-01-13 08:00:00,When Will Inflation Go Down?
2023-01-10 08:00:00,Consumer Shopping Habits Show Continued Caution Despite Easing Inflation
2023-01-10 08:00:00,The Global Economic Outlook in Five Charts
2023-01-12 08:00:00,"FedViews: January 12, 2023"
2023-01-12 08:00:00,Grocery inflation slows again in December
2023-01-20 08:00:00,Weekly update – inflation continues to loom large as 2023 gets properly underway
2023-01-15 08:00:00,"High inflation is to blame for these strikes, not trade unions"
2023-01-19 08:00:00,Cost of living: Japan inflation jumps to new 41-year high
2023-01-18 08:00:00,"Inflation Falls, But has it Peaked?"
2023-01-18 08:00:00,UK inflation drops but food keeps inflation high
2023-01-17 08:00:00,"UK/FTSE 100: elated, decorrelated and just a bit inflated"
2023-01-19 08:00:00,What Impact Does Remote Work Have On Inflation?
2023-01-19 08:00:00,The FTSE 100 stocks most highly rated by analysts
2023-01-18 08:00:00,What does the latest dip in inflation mean and where are price pressures easing?
2023-01-19 08:00:00,Inflation Disparities by Race and Income Narrow
2023-01-16 08:00:00,How will higher interest rates and inflation affect impairment testing of non-financial assets?
2023-01-18 08:00:00,"UK inflation edges down to 10.5% in December, food prices surge"
2023-01-19 08:00:00,US inflation falls for the first time since 2020
2023-01-19 11:49:52,Boom time: what the Inflation Reduction Act means for US renewables manufacturers
2023-01-18 08:00:00,How to invest in a year of stubborn inflation
2023-01-17 08:00:00,"Davos 2023: Inflation slows, but no end in sight for the cost of living crisis"
2023-01-15 08:00:00,Risky US corporate bonds rebound strongly as inflation threat recedes
2023-01-17 08:00:00,"Pay rises at fastest pace for over 20 years, but below inflation"
2023-01-20 08:00:00,UK shoppers cut back on spending as inflation takes its toll
2023-01-19 08:00:00,Japan’s core inflation hits 41-year high with central bank under policy pressure
2023-01-20 08:00:00,German producer price inflation eases to lowest since November 2021
2023-01-15 08:00:00,British pound fundamental forecast: GBP/USD turns to UK CPI after US inflation
2023-01-18 08:00:00,Inflation: Basic products like milk and cheese soar in price
2023-01-18 08:00:00,Chancellor Jeremy Hunt branded 'Mr Bean' for video
2023-01-16 08:00:00,Dollar retreat continues amid inflation optimism
2023-01-18 08:00:00,Euro zone Dec inflation eases to 9.2% y/y as expected
2023-01-16 08:00:00,Easier for Sky customers to get cheaper internet thanks to DWP scheme
2023-01-20 08:00:00,Wake up and buy the coffee: inflation raises cost of a takeaway cup
2023-01-18 08:00:00,Nowcasting inflation with Lasso-regularized vector autoregressions and mixed frequency data
2023-01-17 08:00:00,German 2022 inflation a post-war record of 7.9%
2023-01-18 08:00:00,"London still has hottest property prices in the UK, but house inflation in the capital is cooling"
2023-01-19 08:00:00,European Central Bank chief vows to 'stay the course' on interest rates to tame inflation
2023-01-18 08:00:00,UK House Price Index: November 2022
2023-01-16 08:00:00,Nigeria Inflation Eases for First Time in 11 Months Before Vote
2023-01-18 08:00:00,Slight dip in UK inflation rate but remains near 40 year high
2023-01-16 08:00:00,Can the FTSE 100 replicate its 2022 outperformance while getting ever closer to its May 2018 record high?
2023-01-18 19:53:26,US 2023 Outlook: The Economic Costs of Curbing Inflation
2023-01-18 08:00:00,"Young, Less Educated Faced Higher Inflation in 2021—But Gaps Now Closed"
2023-01-16 08:00:00,Facing inflation: lab heads tighten supplies budgets
2023-01-20 08:00:00,Turkey: The Impact of Inflation on Retail Tissue
2023-01-20 08:00:00,Are Inflation Pressures Impacting Manufacturers’ Sustainability Goals?
2023-01-20 08:00:00,Alarm as inflation in Japan hits 4% for first time since 1981
2023-01-16 08:00:00,Increased interest rate on the Court Funds Office special and basic accounts
2023-01-20 08:00:00,John Humphrys
2023-01-18 08:00:00,Rural Households Hit Hardest by Inflation in 2021-22
2023-01-20 08:00:00,Energy bills rise for 2.5 million homes on Economy 7
2023-01-17 08:00:00,Inflation in Asia: How leaders can prepare for volatility
2023-01-17 08:00:00,"Turkey's inflation seen at 42.5% in 2023, GDP growth at 3%"
2023-01-18 08:00:00,Inflation set to ease back further thanks to steep fall in fuel prices
2023-01-18 08:00:00,‘Bloody hard work’: baker Warburtons battles soaring food inflation
2023-01-18 08:00:00,South Africa inflation dips to 7.2% y/y in December as forecast
2023-01-19 08:00:00,Aldi and Lidl shoppers face highest inflation hikes: Cost of basic groceries rise by more than 20%
2023-01-16 08:00:00,Feed-in Tariffs for Solar and Wind Power Projects in Vietnam
2023-01-20 08:00:00,"The inflation crisis is stopping us from building new homes, says Peabody chief"
2023-01-17 08:00:00,Protests over food and fuel surged in 2022 — the biggest were in Europe
2023-01-19 08:00:00,Inflation Fell to 1.9% in the Second Half of 2022 from 10.7% in the First
2023-01-20 08:00:00,Inflation should not change how policymakers respond to recession
2023-01-19 08:00:00,Where the Inflation Reduction Act tailwinds are blowing
2023-01-16 08:00:00,How not to criticize a central bank: A lesson for Italy from some old German ghosts
2023-01-19 08:00:00,Jamie Dimon and James Gorman at odds over future rate rises
2023-01-16 08:00:00,Venezuela’s teachers march for better pay amid soaring inflation
2023-01-19 08:00:00,Jamie Dimon says rates will rise above 5% because there is still 'a lot of underlying inflation'
2023-01-16 08:00:00,"2023, a testing year: Will the macro-scenario range widen or narrow?"
2023-01-17 08:00:00,Inflation Isn't Coming Down Without a Recession: JPMorgan's Michele
2023-01-20 08:00:00,Nationwide and Halifax cut mortgage interest rates by up to 0.2%
2023-01-18 08:00:00,Can EU anger at Biden’s ‘protectionist’ green deal translate into effective action?
2023-01-19 08:00:00,Top Fed Officials See Progress on Inflation Fight
2023-01-19 08:00:00,"Electricity prices surged 14.3% in 2022, double overall inflation: US report"
2023-01-16 08:00:00,McDonald’s Sweden Lets People Escape Inflation by Traveling Back in Time
2023-01-18 08:00:00,Is the U.S. Inflation Reduction Act Hurting the German Economy?
2023-01-19 08:00:00,Inflation and Rising Food Prices: How Does Federal Food Assistance Change?
2023-01-17 08:00:00,WTAS: Inflation Reduction Act already impacting R&D decisions
2023-01-18 08:00:00,Recession risks and inflation indicators: previewing January's US flash PMI data
2023-01-19 08:00:00,Procter & Gamble Sales Fall for First Time in Years as Inflation Squeezes Shoppers (Published 2023)
2023-01-20 08:00:00,"Reducing inflation without triggering high unemployment is possible, Fed study says. The key is to ignore the lessons of the 1960s"
2023-01-16 08:00:00,Qatar inflation surges 5.93% following World Cup hosting
2023-01-18 08:00:00,"Amid inflation, more middle-class Americans struggle to make ends meet"
2023-01-19 08:00:00,Bank of Japan maintains its ultralow interest rate policy
2023-01-17 08:00:00,"Egyptians Crushed by Currency, Inflation"
2023-01-17 08:00:00,The CEO of Unilever says we might be at ‘peak inflation’ but prices are still going up
2023-01-15 08:00:00,Saudi inflation edges up to 3.3% in December
2023-01-19 08:00:00,Bank of England's Andrew Bailey suggests interest rates could peak at 4.5%
2023-01-19 08:00:00,"Inflation has less of an impact on snacking than meals, Mondelēz finds"
2023-01-16 08:00:00,Shopper Rebellion Against Higher Prices Helps Slow Inflation
2023-01-17 08:00:00,Are Inflation Expectations Well Anchored in Mexico?
2023-01-19 08:00:00,"Inflation hasn’t increased US food insecurity overall, according to our new tracker"
2023-01-19 08:00:00,"Turkey cenbank holds rate at 9%, inflation to dip from 64%"
2023-01-18 08:00:00,Indian tariffs crush business for Washington Red Delicious apple farmers
2023-01-18 08:00:00,Gold nudges lower as Fed members bat for higher interest rates
2023-01-20 08:00:00,Has the drop in immigration contributed to inflation?
2023-01-16 08:00:00,Venezuelan teachers march for better pay amid sky-high inflation
2023-01-19 08:00:00,House prices in London still highest in the country but inflation drops to the lowest in the UK
2023-01-16 08:00:00,"India's rising home prices, rentals a new inflation threat"
2023-01-18 08:00:00,"Inflation is battering lower-income households most as food, housing costs soar, Fed study says"
2023-01-21 08:00:00,"Japan reports its inflation hit 4%, a 41-year high in December"
2023-01-16 08:00:00,Inflation is the biggest threat today and central banks have to do a little more to bring it down: Bill Wi
2023-01-18 08:00:00,Inflation softens for a second month
2023-01-16 08:00:00,Life expectancy can have a greater impact than even record high inflation on how long your retirement savings will last
2023-01-16 08:00:00,Why your paycheck isn’t keeping up with inflation
2023-01-23 08:00:00,Strikes: why refusing public sector pay rises won’t help reduce inflation
2023-01-27 08:00:00,How should you fight inflation? (Spoiler alert: not with interest rate rises) | Joseph Stiglitz
2023-01-25 08:00:00,Food price inflation: interactive visualisation tool
2023-01-25 08:00:00,High inflation erodes trust in the ECB
2023-01-26 08:00:00,Inflation derivatives house of the year: Citi
2023-01-25 08:00:00,Egyptians offered loans to buy books as inflation soars
2023-01-26 08:00:00,Have economists misunderstood inflation?
