date,title
2025-05-16 10:11:27,FTSE 100 LIVE: Stocks rise on trade war optimism and hopes for weaker inflation - Yahoo
2025-05-16 06:06:55,FTSE 100:​​​​​​​ Pound Gains on Weaker Dollar as UK GDP Tops Forecasts - Live - Bloomberg
2025-05-15 06:09:36,"GDP first quarterly estimate, UK: January to March 2025 - Office for National Statistics"
2025-05-15 17:00:01,Money blog: 'Game changing' 100% mortgage launched; Asda axes discount for NHS staff - Sky News
2025-05-14 07:00:00,Mortgage News: Wave Of Rate Reductions Ripples Out To Smaller Lenders - Forbes
2025-05-14 00:00:00,UK shares are booming again as the FTSE recovers! Here’s what I’m watching - Fool UK
2025-05-14 08:20:10,"FTSE 100 steady again as interest rate concerns creep in, Imperial Brands weighs - UK Investor Magazine"
2025-05-14 18:33:45,The best UK residential mortgage rates this week - Moneyfacts
2025-05-13 16:29:29,"British stocks mixed as investors assess US inflation, UK labour market report - Reuters"
2025-05-13 16:02:52,"FTSE 100 ends the day lower as US-China tariff pause rally wanes, 13 May 2025 17:02 - Shares Magazine"
2025-05-13 15:59:00,"FTSE 100 Live: Stocks flat as UK unemployment rate rises, US growth forecasts hiked - Proactive Investors"
2025-05-15 06:09:35,"GDP monthly estimate, UK: March 2025 - Office for National Statistics"
2025-05-15 12:06:18,Sub-4% mortgage rates on the rise as Bank of England cuts interest rates - Yahoo
2025-05-15 14:20:02,Money blog: New Rightmove mortgage tool could have 'dangerous' consequences - Sky News
2025-05-14 15:48:00,Is BP 1 of the best UK shares to buy right now? - Fool UK
2025-05-13 11:46:39,"Bank of England may keep interest rates higher for longer, warns chief economist - Yahoo"
2025-05-15 09:57:18,"Interest rate cuts would ‘boost growth’, businesses tell Bank of England - Yahoo"
2025-05-13 15:32:40,"FTSE closes flat, Wall Street mixed as US consumer inflation data comes in cool - Yahoo"
2025-05-12 15:44:39,Stocks head higher as US and China agree temporary deal to cut tariffs - Yahoo
2025-05-13 11:16:31,"British stocks mixed as investors assess US inflation, UK labour market report - Yahoo News UK"
2025-05-13 10:06:07,Here’s where analysts expect the Lloyds share price to be a year from now - Yahoo
2025-04-28 07:00:00,Will the Bank of England Cut Interest Rates in May? - Morningstar
2025-05-13 19:01:49,Ferguson Marine shipyard confirms new delay and cost rise for MV Glen Rosa ferry - Sky News
2025-05-14 15:39:46,Wall Street rises and FTSE falls as China hits out at UK-US trade deal - Yahoo
2025-05-08 13:09:56,IoD press release: MPC vote by surprisingly narrow 5-4 to cut rates - Institute of Directors
2025-05-13 11:59:56,"FTSE 100 Live 13 May: M&S posts cyber crisis update, jobless rate at 4-year high - London Evening Standard"
2025-05-08 16:04:52,Wall Street rises on trade optimism as Trump announces US-UK trade deal - Yahoo
2025-04-22 07:00:00,"100% chance that Bank of England will cut interest rates next month, markets predict - Sky News"
2025-05-12 06:51:00,"Prediction: 1 year from now, the Rolls-Royce share price could turn £5,000 into… - Yahoo"
2025-05-08 08:51:37,Lenders in mortgage price war as Bank of England cuts interest rates - Yahoo
2025-05-08 16:06:03,FTSE 100 ends lower after ‘hawkish’ BoE rate cut - Shares Magazine
2025-05-13 00:26:51,"Samsung Galaxy S25 Edge UK release date, price and how to pre-order today - Radio Times"
2025-05-07 07:00:00,FTSE 100 ends record run of gains as UK and US rates decisions loom - London Evening Standard
2025-05-06 07:00:00,FTSE 100 wavers and US stocks lower as UK and India strike trade deal - Yahoo
2025-05-02 07:00:00,FTSE notches up its longest-ever winning streak with 15th day of gains – as it happened - The Guardian
2025-04-16 07:00:00,"Consumer price inflation, UK: March 2025 - Office for National Statistics"
2025-05-06 07:00:00,UK business activity falls for the first time since October 2023; US trade deficit hits record; FTSE 100’s record run continues – as it happened - The Guardian
2025-01-17 08:00:00,FTSE 100 hits record as interest rate hopes push down UK borrowing costs - The Guardian
2025-05-08 11:10:18,FTSE 100 higher as Bank of England cuts rates - UK Investor Magazine
2025-05-07 18:16:02,Wall Street mixed as Federal Reserve holds interest rates - Yahoo
2025-05-01 07:00:00,GDP international comparisons: Economic indicators - The House of Commons Library
2025-04-30 07:00:00,Mini price war among lenders sparks under-4% mortgage deals - Yahoo
2025-05-08 16:40:00,FTSE 100 wavers but Wall Street stocks surge after UK-US trade deal - The Independent
2025-03-26 07:00:00,Economic and fiscal outlook – March 2025 - Office for Budget Responsibility
2025-04-22 07:00:00,SPDR FTSE UK All Share ETF: April 2025 update - Hargreaves Lansdown
2025-04-24 07:00:00,Major lenders bring back under-4% mortgages amid interest rate cut hopes - Yahoo
2025-03-20 07:00:00,"Medicine levy makes the UK un-investable, say pharma leaders - Association of the British Pharmaceutical Industry (ABPI)"
2025-05-08 16:42:20,Wall Street stocks surge after UK-US trade deal while FTSE 100 wavers - London Evening Standard
2025-05-12 18:54:28,"EU ‘nastier than China’, claims Trump - The Telegraph"
2025-05-09 04:00:30,"Pension funds should invest more in UK equities, investors tell ministers - Financial Times"
2025-02-24 08:00:00,UK equities − a haven for income and value - LSEG
2025-04-15 07:00:00,"Labour market overview, UK: April 2025 - Office for National Statistics"
2025-01-07 08:00:00,The challenges for UK interest rates and inflation in 2025 - LSE Business Review - LSE Blogs
2025-05-06 07:00:00,UK's FTSE 100 flat as investors assess Trump's latest tariffs ahead of Fed - Reuters
2025-03-24 07:00:00,Stress testing the UK banking system: Key elements of the 2025 Bank Capital stress test - Bank of England
2025-03-05 08:00:00,Top FTSE 100 UK Dividend Paying Stocks - Morningstar
2025-04-11 07:00:00,"GDP monthly estimate, UK: February 2025 - Office for National Statistics"
2025-01-15 08:00:00,"UK Inflation Rate Drops, Boosting Interest-Rate Cut Hopes - Morningstar"
2025-03-20 07:00:00,Wall Street up and FTSE down as Bank of England leaves interest rates on hold - Yahoo
2025-04-25 07:00:00,Bank of Russia keeps the key rate at 21.00% p.a. - Центральный Банк России
2025-04-17 07:00:00,Monetary policy decisions - European Central Bank
2025-05-09 07:00:00,Latest bid for a UK property firm in 2025 may boost brick-and-mortar plays - AJ Bell
2025-04-04 07:00:00,Trillions wiped off global stock markets as Trump's tariffs unleash chaos - Yahoo
2025-03-19 07:00:00,Bluefin Tuna Catch and Release Recreational Fishery (CRRF) Statistics published - GOV.UK
2025-01-21 08:00:00,Why Has the FTSE 100 Hit a Record High? - Morningstar
2024-10-23 07:00:00,Real Living Wage Increases to £12.60 in UK and £13.85 in London - Living Wage Foundation
2025-04-11 07:00:00,UK trade: February 2025 - Office for National Statistics
2025-05-09 07:32:45,"Drowning in debt amid falling oil prices, can the BP share price recover? - Yahoo"
2025-02-06 08:00:00,"UK interest rates latest: Bank of England cuts interest rates to 4.5%, the lowest level since June 2023 - BBC"
2025-02-13 08:00:00,"GDP monthly estimate, UK: December 2024 - Office for National Statistics"
2025-04-16 07:00:00,UK inflation rate: How quickly are prices rising? - BBC
2025-03-14 07:00:00,"GDP monthly estimate, UK: January 2025 - Office for National Statistics"
2025-02-13 08:00:00,"GDP first quarterly estimate, UK: October to December 2024 - Office for National Statistics"
2025-04-03 07:00:00,What Trump's tariffs could mean for UK mortgage rates - Yahoo
2025-03-28 07:00:00,"GDP quarterly national accounts, UK: October to December 2024 - Office for National Statistics"
2025-03-17 07:00:00,Radical action plan to cut red tape and kickstart growth - GOV.UK
2025-02-06 08:00:00,HMRC late payment interest rates to be revised after Bank of England lowers base rate - GOV.UK
2025-05-08 07:00:00,"Europe stocks close higher but U.K.'s FTSE 100 falls amid U.S. trade deal, rate cut - CNBC"
2025-01-02 08:00:00,What to Expect From the UK Stock Market in 2025 - Morningstar
2025-05-08 07:00:00,British equities mixed as markets mull US-UK trade deal - Reuters
2025-02-19 08:00:00,UK House Price Index for December 2024 - GOV.UK
2025-03-28 07:00:00,National Living Wage increases to £12.21 - GOV.UK
2025-04-10 07:00:00,UK mortgage lenders cut rates after Trump tariffs - Yahoo
2025-02-06 08:00:00,Pound plunges after Bank of England cuts interest rates - The Telegraph
2025-04-01 07:00:00,Child Benefit boost for millions of families - GOV.UK
2025-04-15 07:00:00,Health care funding - The Health Foundation
2024-12-23 08:00:00,"GDP quarterly national accounts, UK: July to September 2024 - Office for National Statistics"
2025-02-19 08:00:00,"Private rent and house prices, UK: February 2025 - Office for National Statistics"
2025-03-04 08:00:00,Boost in funding for care homes providing nursing - GOV.UK
2024-11-06 08:00:00,Report under section 79A of the Banking Act 2009 on the transfer of Silicon Valley Bank UK to HSBC UK - Bank of England
2024-11-22 08:00:00,Energy price cap will rise by 1.2% from January - Ofgem
2025-01-14 08:00:00,Foreign direct investment involving UK companies: 2023 - Office for National Statistics
2024-09-16 07:00:00,What if the Fed Cuts Interest Rates by Half a Point? - Morningstar
2025-01-16 08:00:00,"GDP monthly estimate, UK: November 2024 - Office for National Statistics"
2024-12-16 04:34:19,Increased activity in the mortgage market anticipated in 2025 - UK Finance
2024-11-13 08:00:00,Next steps set out to permanently cut business rates for the high street - GOV.UK
2025-01-15 08:00:00,UK House Price Index for November 2024 - GOV.UK
2024-10-30 07:00:00,Chancellor chooses a Budget to rebuild Britain - GOV.UK
2025-04-01 07:00:00,ISA ideas: low-cost index tracker fund options - fidelity.co.uk
2024-10-29 07:00:00,National Living Wage to increase to £12.21 in April 2025 - GOV.UK
