date,title
2025-05-12 01:53:07,"Bolsa hoy e Ibex 35, en directo: últimas noticias de los mercados, Euríbor, Wall Street, Nasdaq, Dow Jones, criptomonedas... - El Economista"
2025-04-05 07:00:00,"Bolsa e Ibex 35 hoy, en directo | Trump hunde las bolsas: Wall St cae un 6% y el Ibex cierra su peor día desde el Covid - El Confidencial"
2025-04-04 07:00:00,Los mercados mundiales entran en pánico ante la guerra comercial desatada por Trump - Cinco Días
2025-04-11 07:00:00,La Reserva Federal se declara lista para intervenir si la situación se descontrola y los mercados reaccionan con alivio - Cinco Días
2025-03-10 07:00:00,El Nasdaq se desploma ante los temores económicos en EE UU y arrastra a las Bolsas mundiales - Cinco Días
2025-03-24 05:29:34,Los mejores y peores del día en el Ibex 35 - El Economista
2025-04-20 22:20:31,Los mercados bajistas duran más de un año de media pero es mejor mantenerse invertido - El Economista
2025-03-07 23:12:49,"Bolsa hoy e Ibex 35, en directo: últimas noticias de los mercados - El Economista"
2025-03-05 08:00:00,Nuevo golpe del BCE: ¿Habrá más recortes de tipos de interés este 2025? - Estrategias de Inversión
2025-03-21 07:00:00,El Ibex pierde los 13.300 puntos en un mar de incertidumbre económica - PR Noticias
2024-09-12 07:00:00,Reconectando el Banco Central Europeo - funcas.es
2024-09-18 07:00:00,La Reserva Federal se lanza a bajar los tipos de forma agresiva tras controlar la inflación - EL PAÍS
2024-09-02 07:00:00,Optimismo en la bolsa: la recuperación económica española impulsa el IBEX 35 a máximos - Diario digital Nueva Tribuna
2024-08-05 07:00:00,Las bolsas y el petróleo se desploman por el miedo a una recesión inminente en EEUU - El Economista
2024-08-05 07:00:00,La tormenta financiera presiona a la Fed para bajar los tipos de interés - EL PAÍS
2025-03-19 07:00:00,La Reserva Federal advierte del aumento de la incertidumbre sobre la economía de Estados Unidos - EL PAÍS
2024-08-05 07:00:00,El temor a una recesión en EE UU desata una tormenta en las Bolsas mundiales - EL PAÍS
2025-03-03 08:00:00,Inflación: estas son las causas y herramientas para combatirla - BBVA
2025-04-09 07:00:00,7 valores del Ibex para refugiarse y 10 para ganar con las subidas - Expansión
2025-04-20 07:00:00,"Los hipotecados, en el filo de la navaja ante los aranceles: una subida de la inflación encarecería las hipotecas y una recesión las bajaría - Infobae"
2025-04-30 07:00:00,"El Ibex resiste la presión y sube un 1,2% el mes en el que los mercados pudieron más que Trump - Cinco Días"
2024-08-05 07:00:00,¿Se avecina una crisis económica? Las razones detrás de la caída de los mercados mundiales - Euronews.com
2023-12-21 08:00:00,"Situación económica de Egipto: desafíos, causas y perspectivas - Política Exterior"
2024-05-12 07:00:00,Así han resistido los hogares españoles a la mayor crisis de precios de los últimos 40 años - Business Insider España
2024-10-18 07:00:00,El salto mortal del BCE para bajar los tipos al 1% en 2025: la hoja de ruta de la que ya habla el mercado - El Economista
2025-01-30 08:00:00,El BCE recorta tipos por quinta vez ante la contracción económica de Francia y Alemania - La Vanguardia
2024-09-24 07:00:00,"Plan que choque chino para reactivar la economía: rebaja de tipos, respaldo al sector inmobiliario y apoyo a las Bolsas - Cinco Días"
2024-12-17 08:00:00,Los nueve frentes que sacudirán 2025: la economía de España como reina de Europa y la hora decisiva del petróleo - El Economista
2024-08-05 07:00:00,Lunes negro en las bolsas mundiales: el Ibex se desploma por el miedo a que EEUU entre en recesión - Infobae
2024-09-24 07:00:00,China anuncia un paquete de estímulos para reavivar la recuperación económica - EFE Noticias
2024-10-17 07:00:00,El BCE baja el precio del dinero por tercera vez en el año - Expansión
2023-12-13 08:00:00,"La Reserva Federal de Estados Unidos prevé bajar los tipos de interés 0,75 puntos en 2024 - EL PAÍS"
2025-04-11 07:00:00,"Aranceles de Trump, última hora del Ibex 35 y las bolsas hoy, en directo | La confianza de los consumidores en EEUU cae por cuarto mes y la gran banca avisa sobre una recesión - El Mundo"
2023-09-14 07:00:00,Lehman Brothers: 15 años ya de una quiebra que cambió el mundo - Cinco Días
2025-04-06 07:00:00,¿Puede la Reserva Federal calmar la tormenta arancelaria de Trump con una apuesta de recorte de tipos? - TradingView
2024-08-05 07:00:00,La Bolsa japonesa se hunde en su peor jornada en 37 años - Cinco Días
2025-02-10 08:00:00,¿Habrá recesión en Europa en 2025? - RankiaPro
2024-06-28 07:00:00,Así impacta a política económica a los fondos de inversión - Estrategias de Inversión
2022-07-19 07:00:00,Explicado: ¿Qué es una recesión? - El Foro Económico Mundial
2025-03-27 07:00:00,El Banco de México recorta en 50 puntos la tasa de interés y la sitúa en 9% ante la escalada arancelaria de Trump - EL PAÍS
2022-07-15 07:00:00,"España no ha recuperado los niveles de actividad previos a la pandemia, pero sí la tasa de crecimiento - newtral.es"
2023-05-30 07:00:00,Historia económica de España a través de las portadas de CincoDías | Fotos | 45º aniversario - Cinco Días
2024-01-31 08:00:00,"El Banco de la República mantiene su política de reducir el precio del dinero: baja del 13% al 12,75% - EL PAÍS"
2023-06-29 20:59:38,Política monetaria y actividad de los bancos centrales - International Monetary Fund
2022-10-21 07:00:00,Cómo puede afectar una recesión económica a mi cuenta bancaria - 20Minutos
2023-01-25 08:00:00,Inversiones y empresas españolas en América Latina: nueva política económica internacional de España hacia América Latina para el siglo XXI - Atalayar
2022-05-20 07:00:00,El calor ‘asfixia’ al euríbor: entre los meses de mayo y agosto registra históricamente sus valores más elevados - iAhorro
2022-07-12 07:00:00,El euro llega a su nivel más bajo en 20 años frente al dólar: qué consecuencias tiene la histórica paridad de las monedas - BBC
2021-11-29 08:00:00,"La tensión de la inflación y la crisis de suministros, los 2 problemas que ponen en riesgo la economía española, según el Banco de España - Business Insider España"
2025-04-20 07:00:00,"Guerra de aranceles, en directo | Starmer defiende en una llamada con Trump el comercio ""libre y abierto"" - LaSexta"
2022-09-15 07:00:00,¿Qué supuso la quiebra de Lehman Brothers? - El Orden Mundial
2020-07-07 07:00:00,Las 14 recesiones de los últimos 150 años (y por qué la del coronavirus sería la cuarta peor) - BBC
2022-11-10 08:00:00,Ya no hace falta perder tu trabajo para no llegar a final de mes: la nueva crisis será de la 'clase media' - Business Insider España
2023-02-02 08:00:00,El valor de las marcas bancarias latinoamericanas crece un 17% según Brand Finance - Brand Finance
2020-09-10 07:00:00,"Así invierten los expertos antes, durante y después de una crisis - Cinco Días"
2023-03-20 07:00:00,Qué está ocurriendo con la banca mundial y cuán preocupante es la situación - BBC
2021-01-24 08:00:00,La economía japonesa post burbuja: tragedia y ruina en la nación que iba a dominar el mundo - El Blog Salmón
2024-02-02 08:00:00,¿Qué es el hard landing? Aplicaciones en economía y ejemplo - Economipedia
2020-08-25 07:00:00,"La Gran Recesión de 2008, una crisis cuya factura estamos pagando todavía - infoLibre"
