date,title
2023-12-25 08:00:00,Inflation has created a dark cloud over how everyday Americans view the economy
2023-12-25 08:00:00,2024 Import-Export Tariffs in China
2023-12-30 08:00:00,"In 2024, Expect Lower Interest Rates And Lower Inflation"
2023-12-28 08:00:00,Brazil’s Annual Inflation Tops All Forecasts in Early December
2023-12-29 08:00:00,Will America manage a soft landing in 2024?
2023-12-29 08:00:00,Spain Inflation Steady in ECB’s First View of Volatile December
2023-12-27 08:00:00,Italian Savings Survey: households and the challenge of inflation
2023-12-26 08:00:00,US extends tariff exclusions on some Chinese categories till May 31
2023-12-29 08:00:00,This Beverage Had The Greatest Price Spike Of Any Grocery Item In 2023—Even As Inflation Eased
2023-12-30 08:00:00,"Summers Warns Inflation, Recession Still ‘Real Risks’: Wall Street Week"
2023-12-27 08:00:00,Spain extends measures to help with living costs into 2024
2023-12-29 08:00:00,Uruguay’s Central Bank Cuts Key Rate to 9% on Tame Inflation
2023-12-30 08:00:00,13 Biggest Stocks That Benefit From High Interest Rates
2023-12-25 08:00:00,BOJ’s Lifting of Negative Interest Rates Nears – Investors Prepare in Earnest
2023-12-28 08:00:00,South Korea’s Cooling Prices Support Expectations of 2024 Easing
2023-12-30 08:00:00,"China's appetite for Australian barley is back, three years after tariffs halted the near-$1 billion market"
2023-12-27 08:00:00,Korea: Restrictive Monetary Policy and Fiscal Discipline Essential for Inflation Stability and Fiscal Sustainability
2023-12-30 08:00:00,"Charlie Bigham on inflation, his success and why he doesn’t make ready meals"
2023-12-28 08:00:00,Zambian Inflation Nears Two-Year High as Kwacha Slump Persists
2023-12-27 08:00:00,What to Expect from the Global Economy in 2024
2023-12-28 08:00:00,Booksellers take a hit from high inflation
2023-12-28 08:00:00,"South Asian nations succeeded in taming inflation. Bangladesh, not so much"
2023-12-26 08:00:00,"Trump Is Primed for a Trade War in a Second Term, Calling for ‘Eye-for-Eye’ Tariffs"
2023-12-29 08:00:00,Tackling soaring inflation to take center stage in 2024 election: survey
2023-12-29 08:00:00,"2023 Stock Market News: Inflation, AI, Big Techs Shape Rebound"
2023-12-26 08:00:00,"US tariffs, chip restrictions stir concerns; China’s abundance of talent sparks optimism for technology progress: Nobel Laureate Thomas Sargent"
2023-12-28 08:00:00,Tyler Cowen on Recent Fed Policy
2023-12-28 08:00:00,"Turkish Lira (TRY/USD), Bonds Fall as Minimum Wage Hike Fuels Inflation Fears"
2023-12-27 08:00:00,Popular 2023 Posts on Two of Our Economics Blogs
2023-12-27 08:00:00,"These 5 charts show how life got pricier, but also cheaper, in 2023"
2023-12-25 08:00:00,Restaurants outpacing grocery stores when it comes to inflation
2023-12-28 08:00:00,Why corporate bankruptcies were up in 2023 despite the improving economy
2023-12-28 08:00:00,The global economy in 2024: Key clues to watch out for
2023-12-25 08:00:00,Bangladesh's Inflation shock: A weaker taka accounts for half of it
2023-12-26 08:00:00,"Pa. sees high grocery price inflation. Economists, senator weigh in"
2023-12-28 08:00:00,Chaotic bond markets to continue to combat inflation and recession fears in 2024
2023-12-27 08:00:00,Deposit interest rates hit record low
2023-12-29 08:00:00,"India's economic growth sustainable, inflation falling: Govt report"
2023-12-27 08:00:00,Economists disagree on Biden’s polling. Even when they’re in love.
2023-12-30 08:00:00,These 4 Indicators Are Key to Watch for Fed Rate Cuts
2023-12-25 08:00:00,"The Fed Will Cut Interest Rates (Six Times!) in 2024, According to Wall Street. Here's What It Means for Stocks"
2023-12-29 08:00:00,Can Indian inflation fall below 4% and economic growth remain strong in 2024? Here's what experts say
2023-12-28 08:00:00,Botswana plans a 1.51% currency depreciation in 2024 to counter inflation
2023-12-29 08:00:00,Stocks fool nearly everyone in 2023 with the S&P soaring 24% and Nasdaq rising an even more formidable 43%
2023-12-26 08:00:00,"Thailand plans new minimum wage hike, keeps inflation target next year"
2023-12-27 08:00:00,Are your tips keeping up with inflation?
2023-12-28 08:00:00,Will interest rates come down in 2024? What the Bank of Canada is watching
2023-12-30 08:00:00,Higher Bank FD interest rates may fall by 50 bps or more in 2024; You have this much time to invest
2023-12-28 08:00:00,"The Conversation: Vancity interim CEO Nez Aquino talks interest rates, economic downturn and whether she wants the permanent gig"
2023-12-25 08:00:00,"A default cycle has started amid the Fed's high interest rates, economists say. These 4 charts explain how severe it is."
2023-12-28 08:00:00,"Singapore, Malaysia to raise consumption tax amid inflation fears"
2023-12-28 08:00:00,The SA suburbs where investment performance was higher than interest rates and inflation
2023-12-29 08:00:00,From AI and inflation to Musk and Swift
2023-12-30 08:00:00,Inflation surged to 5.8% in November
2024-01-04 08:00:00,FTSE 100: 40 years of ups and downs at the top of British business
2024-01-02 08:00:00,"Footsie turns 40: FTSE 100’s rise, rise and stagnation over four decades"
2024-01-02 08:00:00,FTSE 100 celebrates 40th birthday – but is it over the hill?
2024-01-05 08:00:00,Eurozone inflation rises to 2.9% in December
2024-01-05 08:00:00,Macron urged to push for dual interest rates at EU level
2024-01-04 08:00:00,FTSE 100 boardrooms show more stability than football club dressing rooms in 2023
2024-01-05 08:00:00,Switzerland Eliminates All Tariffs on All Industrial Goods
2024-01-02 08:00:00,China reinstates coal tariffs threatening Russian exporters
2024-01-02 08:00:00,Is the FTSE 100 still fulfilling its purpose and worth investing in at 40?
2024-01-02 08:00:00,Can Trump ruin Biden’s Inflation Reduction Act?
2024-01-01 08:00:00,"Change to the Plan 2, Plan 5 and Postgraduate (PG) student loan interest rates announcement"
2024-01-03 08:00:00,Quantitative easing generates more inflation than conventional monetary policy
2024-01-04 08:00:00,The FTSE 100 turns 40 – what’s changed and what’s next?
2024-01-04 08:00:00,"FTSE 100 bosses earn UK average salary in three days, says High Pay Centre"
2024-01-03 08:00:00,Turkey inflation soars to over one-year high at 64.8%
2024-01-03 08:00:00,"Labor could raise welfare payments for cost-of-living relief without stoking inflation, economists say"
2024-01-01 08:00:00,UK food inflation falls in December as shops roll out seasonal offers
2024-01-02 08:00:00,FTSE 100 at 40 years old: how many of the original companies remain on the index?
2024-01-04 08:00:00,"FTSE 100 chiefs paid more in three days than average UK yearly wage, study says | Executive pay and bonuses"
2024-01-01 08:00:00,UK shop inflation sticks at 4.3% despite lower food price rises
2024-01-05 08:00:00,Interest rate hikes 'net positive' for economy but not everyone
2024-01-03 08:00:00,Rishi Sunak’s five pledges: one year on
2024-01-05 08:00:00,Euro area bank interest rate statistics: November 2023
2024-01-03 08:00:00,New report warns horticulture growth is under threat
2024-01-04 08:00:00,"Book notes: We need to talk about inflation, by Stephen King"
2024-01-02 08:00:00,Nissan and GM warn Trump’s plans to gut Inflation Reduction Act will hurt US EV sales
2024-01-02 08:00:00,"If I’d put £1k in the FTSE 100 at the start of 2023, here’s how much I’d have now!"
2024-01-05 08:00:00,Italian inflation declines while consumer prices surge by 0.2%
2023-12-31 08:00:00,"Central banks poised for rate cuts in 2024, investors and economists predict"
2024-01-04 08:00:00,"Protracted period of low growth looms large, undermining progress on sustainable development"
2023-12-31 08:00:00,How will the UK economy compare to other countries in 2024?
2024-01-05 08:00:00,FTSE 100 CEOs have already earned more than average yearly salary
2024-01-03 08:00:00,The FTSE 100 turns 40 – these are the stocks that have performed best
2024-01-03 08:00:00,FTSE turns 40
2024-01-04 08:00:00,French inflation rises on higher energy prices
2024-01-02 08:00:00,The accidental icon: The fascinating history of how the FTSE 100 was created 40 years ago today
2024-01-03 08:00:00,2023 busy with FTSE 100 CEO departures; will 2024 be the same?
2024-01-02 08:00:00,Claims costs continue to rise in 2024
2024-01-01 08:00:00,"FT economists survey: ‘anaemic’ economy needs ‘investment, investment, investment’"
2024-01-04 08:00:00,What are junior doctors paid
2024-01-02 17:38:11,Are these the best FTSE 100 dividend stocks to watch in February 2024?
2024-01-02 08:00:00,Where to next for the FTSE 100 and SP 500?
2024-01-05 08:00:00,Which UK savings accounts pay the highest interest rates?
2024-01-03 08:00:00,​​​Where to next for the FTSE 100 as it celebrates its 40th anniversary?
2024-01-03 08:00:00,Has America really escaped inflation?
2024-01-04 08:00:00,Global PMI data point to stalled descent of inflation
2024-01-02 08:00:00,FTSE 100's 40th Birthday Is a Very British Disappointment
2023-12-31 08:00:00,These are the lowest P/E value stocks on the whole FTSE 100
2024-01-04 08:00:00,High Pay Hour 2024
2024-01-04 08:00:00,Germany sees inflation ease to 5.9% for 2023
2024-01-04 08:00:00,The global economy is poised for another tumultuous year in 2024 | Kenneth Rogoff
2024-01-02 08:00:00,FTSE 100 dividends in January total almost £2.6bn
2024-01-05 08:00:00,Inflation isn’t beaten yet. Price rises are accelerating again in Europe
2024-01-05 08:00:00,"Macro week ahead: US inflation in market spotlight, UK GDP could signal recession"
2024-01-04 08:00:00,Falling mortgage rates still feel a squeeze – how to cut your repayments
2024-01-03 08:00:00,Grocery inflation sees fastest monthly drop as households spend all-time high
2024-01-06 08:00:00,‘Everyone cites Covid and Brexit’: number of UK businesses going bust rises 52% in two years
2024-01-04 08:00:00,'Little luxuries': The affordable treats driving consumer spending
2024-01-03 08:00:00,Grim outlook for the European staffing sector in 2024
2024-01-06 08:00:00,Trump Return Could See Wine Panic Buying
2024-01-01 08:00:00,2023: Europe's year explained in charts and data
2024-01-03 08:00:00,Mortgage rates are falling – five-year fixes to drop under 4%. But will they get cheaper?
2024-01-03 08:00:00,"Turkish inflation climbs to nearly 65%, with more rises expected"
2023-12-31 08:00:00,Inflation: It’s Not the Supply Side
2024-01-04 08:00:00,What's the outlook for jobs and pay in 2024?
2024-01-04 08:00:00,Inflation and its demons define Japan’s precarious 2023
2024-01-02 08:00:00,US free trade coalition urges USTR to publish China Section 301 tariffs review
2024-01-05 08:00:00,"Inflation rose last month in Europe, could keep rising after months of decline"
2024-01-03 08:00:00,Will America’s Good News on Inflation Last? (Published 2024)
2024-01-02 08:00:00,Opinion | Trump’s Tariffs and the Common Man
2024-01-04 08:00:00,Red sea shipping attacks will lead to ‘inevitable’ food inflation
2024-01-05 12:16:27,20 most expensive Premier League transfers ever based on inflation-adjusted fees
2024-01-04 08:00:00,"One year on, is Rishi Sunak fulfilling his five promises to voters?"
2024-01-02 08:00:00,Global stock markets see strongest performance since 2019
2024-01-02 08:00:00,Why you may not be able to get on the housing ladder or buy a bigger home in 2024
2024-01-03 08:00:00,The Big Picture: Back to the Future
2024-01-04 08:00:00,"As Inflation Retreats, How Will Equities Perform in 2024?"
2024-01-05 08:00:00,Will the UK economy be less miserable this year?
2024-01-04 08:00:00,The Deep dive: Impact of inflation on banks and credit unions
2024-01-01 08:00:00,Peru ends 2023 with inflation rate of 3.24%
2024-01-04 08:00:00,'Slightly hawkish' Banxico calls for caution on rates as inflation still sticky
2024-01-05 08:00:00,Consumer confidence is rising amid gloomy economic news – here’s what that means and why it matters
2024-01-04 08:00:00,How Supply-Chain Snarls Made Everyone Wrong on Inflation
2024-01-04 08:00:00,Egypt targets inflation rate of less than 10% by 2025
2024-01-04 08:00:00,Sainsbury’s increases pay as supermarkets battle for staff
2024-01-05 08:00:00,Turkish car market goes into reverse as reforms start to bite
2024-01-04 08:00:00,"Why Red Sea attacks matter for economy, inflation: Extra 10 days for 15% of international trade"
2024-01-05 08:00:00,Global finances: what does 2024 hold in store for major economies and markets?
2024-01-04 08:00:00,Strangulation not suffocation
2024-01-03 08:00:00,Mortgage rates look set to keep falling in 2024 as Halifax slashes prices
2024-01-03 08:00:00,"Fintech in 2024: investors eye payments, interest rates and a shift to emerging markets"
2024-01-01 08:00:00,Australia’s property market faces fresh peaks and troughs with slowing prices and interest rates tipped to drop | Housing
2024-01-02 08:00:00,Equity Outlook: Three Questions for Investors in 2024
2024-01-02 08:00:00,Australia PM considers extra inflation relief as families struggle
2024-01-04 08:00:00,Philippine inflation at near 2-year low but rates likely to stay elevated
2024-01-01 08:00:00,Pakistan Inflation Quickens Despite Tight Monetary Policy Stance
2024-01-05 08:00:00,Labor report indicates U.S. job market’s resilience amid high interest rates
2024-01-03 08:00:00,"Fed minutes cite lower inflation risks, concern about 'overly restrictive' policy"
2024-01-05 08:00:00,Inflation sees turnover and profit drop at Ogilvie’s construction business
2024-01-04 08:00:00,Biden administration extends China tariff exclusions — again
2024-01-10 08:00:00,Inflation in the eastern euro area: reasons and risks
2024-01-12 08:00:00,Hopes for lower inflation add to signs of life for UK economy
2024-01-11 08:00:00,Three reasons why UK inflation will swiftly return to target
2024-01-09 08:00:00,Higher long-term interest rates and the cost of student loans
2024-01-09 08:00:00,The ECB is wrong. Green dual interest rates are possible – and necessary
2024-01-11 08:00:00,US inflation picks up more than expected in December
2024-01-11 08:00:00,What is the FTSE 100 for?
2024-01-11 08:00:00,How rising cost of living is impacting sport and physical activity
2024-01-11 08:00:00,Inflation adds £10bn to HS2 Ltd’s phase one estimated cost
2024-01-10 08:00:00,HS2 could cost nearly £68bn after inflation
2024-01-08 08:00:00,Why the middle class benefits from inflation
2024-01-09 08:00:00,"Return to inflation-linked social rent hikes necessary for landlord investment, CIH says"
2024-01-10 08:00:00,Richard Byles on Jamaica’s inflation-targeting baptism of fire
2024-01-12 08:00:00,"Charts Spotlight Inflation, Economic Growth, Globalization, and Climate Change"
2024-01-11 08:00:00,Could inflation turn from a problem to a solution?
2024-01-10 08:00:00,Weakness in construction and its related sectors show the impact of interest rate hikes
2024-01-11 08:00:00,Argentina’s annual inflation tops 200% as Javier Milei confronts crisis
2024-01-09 08:00:00,Red Sea shipping attacks add to inflation risks
2024-01-10 08:00:00,"Stephanie Kelton: ‘Inflation has come down in spite of the Fed, not because of it’"
2024-01-08 08:00:00,We made a chart of the FTSE’s biggest companies and nearly lost our minds
2024-01-07 08:00:00,Swedish December inflation preview: Touch base
2024-01-10 08:00:00,Has Team Transitory really won America’s inflation debate?
2024-01-11 08:00:00,ECB's Lagarde: rate cuts to occur if it is clear inflation has fallen to 2%
2024-01-08 08:00:00,Government to lose money on all student loans – even those repaid in full
2024-01-11 08:00:00,"Argentina annual inflation tops 211%, highest since early 90s"
2024-01-12 08:00:00,December 2023 CPI Shows 0.3% Inflation Rise
2024-01-11 08:00:00,Europe’s under-the-radar industrial policy: intervention in electricity pricing
2024-01-11 08:00:00,When can we stop worrying about rising prices? The latest inflation report offers no easy answers
2024-01-10 08:00:00,Ukraine's Jan-Dec 2023 inflation slows to 12.9%
2024-01-12 08:00:00,Red Sea crisis risks 2024 inflation spike
2024-01-12 08:00:00,The pandemic inflation episode is still unwinding
2024-01-11 08:00:00,"UN Report Projects 2024 Growth to Slow, Inflation to Decline"
2024-01-13 08:00:00,How interest rates are reshaping the financial landscape
2024-01-08 08:00:00,Former MPC member claims BoE will not be able to cut interest rates in 2024 – reports
2024-01-11 08:00:00,NBU 2023 Inflation Update
2024-01-12 08:00:00,Argentina and Türkiye: a tale of two adjustments
2024-01-11 08:00:00,Will spiking shipping costs cause inflation to surge?
2024-01-11 08:00:00,Housing Affordability Remains Stretched Amid Higher Interest Rate Environment
2024-01-12 08:00:00,Greece tackles high prices on basic food products
2024-01-11 08:00:00,How Much Will the Inflation Reduction Act Reduce Emissions?
2024-01-08 08:00:00,‘Unsustainable’ US debt: Could the Fed consider cutting interest rates?
2024-01-09 08:00:00,Measuring Price Inflation and Growth in Economic Well-Being with Income-Dependent Preferences
2024-01-09 08:00:00,Staff costs increase by £9m at major care charity to keep up with wage inflation
2024-01-12 08:00:00,Putin waged a trade war long before bombing Ukraine. Which side is winning?
2024-01-11 08:00:00,"Fresh Inflation Data Shows Intact, but Bumpy, Cool-Down (Published 2024)"
2024-01-08 08:00:00,Mortgage rates: Five ways to save money
2024-01-09 20:48:50,"US 2024 Outlook – Slowdown, Recession and Last-Mile Inflation Risks Ahead?"
2024-01-12 08:00:00,NFU experts' deep dive into the latest key labour market indicators
2024-01-12 08:00:00,Romania's annual inflation eases to 6.6% in Dec
2024-01-09 08:00:00,How was inflation in 2023 for poor and rich households in Spain?
2024-01-09 08:00:00,"Global economy set for weakest growth since pandemic, warns World Bank"
2024-01-10 08:00:00,Don’t Expect a Return to Ultra-Low Interest Rates
2024-01-09 08:00:00,Student loan costs to balloon by £10bn a year
2024-01-08 08:00:00,Think-tank says higher interest rates have given boost to household incomes
2024-01-12 08:00:00,Asda price match move makes it cheapest as inflation falls to 2.9%
2024-01-11 08:00:00,"Inflation rate 3.8 percent in 2023, excluding energy at 6.5 percent"
2024-01-11 08:00:00,Inflation rate grows to 3.4% in December 2023: High housing costs and rent are to blame
2024-01-12 08:00:00,Nationwide Building Society slashes savings interest rates – full list of accounts
2024-01-10 08:00:00,Greggs CEO: ‘Popularity’ of brand has boosted sales as inflationary pricing is eased
2024-01-11 08:00:00,"Consumer prices rose 0.3% in December, higher than expected, pushing the annual rate to 3.4%"
2024-01-12 08:00:00,‘Rates aren’t rising at all’: Freelancers lament stagnated rates amidst inflation
2024-01-08 08:00:00,Online news paywall inflation running at 20% in UK
2024-01-12 08:00:00,Serbia closes 2023 with 7.6% annual inflation
2024-01-11 08:00:00,Brazil’s Annual Inflation Rate Slows Within Target Range by December
2024-01-12 08:00:00,'Remarkable' surge in auto insurance costs fans US inflation
2024-01-08 08:00:00,Lower Interest Rates Do Not Drive Economic Growth
2024-01-11 08:00:00,Data reveals extent of grade inflation at UofG
2024-01-09 08:00:00,"Farewell to Earnest Jackson, the iconic voice behind Planet Money's 'Inflation' song"
2024-01-10 08:00:00,JP Morgan CEO warns high inflation is echo of 1970s as he rubbishes 'Goldilocks' economic scenario
2024-01-13 08:00:00,"As Argentina's annual inflation surpasses 211%, digital assets provide hope for population battling hyperinflation"
2024-01-11 08:00:00,Argentina takes unwelcome Latin America inflation crown from Venezuela
2024-01-08 08:00:00,Britain is crying out for more investment. Here’s why Labour shouldn’t worry about spending big | Carsten Jung
2024-01-12 08:00:00,"Wall Street little changed after inflation, labor market data"
2024-01-11 08:00:00,Should I invest in gold now that inflation is climbing?
2024-01-11 08:00:00,Here’s the inflation breakdown for December 2023 — in one chart
2024-01-11 08:00:00,Milei’s first inflation rate hits 25.5%
2024-01-12 08:00:00,"Venezuela's 2023 inflation hit nearly 190%, but December prices barely ticked up"
2024-01-11 08:00:00,"US Inflation Picks Up, Signaling Bumpy Path for Fed"
2024-01-09 08:00:00,Irish ‘unicorn’ rules out London IPO after spat with FTSE 100 private equity firm
2024-01-12 08:00:00,Red Sea: Cheap drone attacks have outsized effect on global economic inflation
2024-01-11 08:00:00,US inflation rises to 3.4%; global trade ‘drops 1.3%’ as Red Sea attacks disrupt shipping – as it happened
2024-01-11 08:00:00,U.S. Hotel Rates Buck Inflation Trend With Year-End Decline
2024-01-11 08:00:00,Inflation Edged Up in December After Rapid Cooling Most of 2023
2024-01-11 08:00:00,"Argentina’s Inflation Hits 211% in 2023, Fastest Gain in Three Decades"
2024-01-12 08:00:00,India Inflation Quickens to 4-Month High on Costlier Food
2024-01-11 08:00:00,NS&I to cut Premium Bond prize rate to 4.4% – are they still worth it?
2024-01-08 08:00:00,Milei praises Minister Caputo and says 30% monthly inflation would be ”a great achievement”
2024-01-09 08:00:00,"Inflation in Japan's capital keeps slowing, takes pressure off BOJ"
2024-01-11 08:00:00,Argentina inflation surges past 200% as economic crisis bites
2024-01-11 08:00:00,Savings Rate of Bangladesh: An Assessment from 2000 to 2020
2024-01-10 08:00:00,Mortgage Rates and Inflation Could Draw Attention to the Fed This Election (Published 2024)
2024-01-10 08:00:00,US Inflation Is Set to Fade in 2024 as Goods Prices Keep Falling
2024-01-11 08:00:00,"​​​EUR/USD, GBP/USD and AUD/USD bullish ahead of US inflation print"
2024-01-08 08:00:00,UK consumers continue to cut spending for 2024
2024-01-11 08:00:00,Red Sea crisis could jeopardize inflation fight as shipping costs spike globally
2024-01-08 08:00:00,2 FTSE 100 housebuilders set for a much better year ahead!
2024-01-12 08:00:00,2024 and beyond: Will it be economic stagnation or the advent of productivity-driven abundance?
2024-01-11 08:00:00,Inflation down to 1.2 percent in December; 3.4 percent excluding energy
2024-01-10 08:00:00,Greggs enjoys bumper Christmas period as it hails easing inflation
2024-01-11 08:00:00,Argentina Poised to Surpass Venezuela With 200% Inflation Crisis
2024-01-17 08:00:00,It’s time for maintenance support to catch up with inflation
2024-01-18 08:00:00,Chart of the week: Inflation
2024-01-15 08:00:00,What’s really going on with Australian inflation
2024-01-19 08:00:00,"Half of recent US inflation due to high corporate profits, report finds"
2024-01-15 08:00:00,"Inflation risk from Red Sea disruption, warns economist"
2024-01-19 08:00:00,Need to Know: How will higher UK inflation affect your assets?
2024-01-17 08:00:00,Inflation surprisingly rises after cost of tobacco increases
2024-01-17 08:00:00,"UK inflation shows surprise rise, denting Bank of England rate cut bets"
2024-01-18 08:00:00,The future of the FTSE 100: what do the next 40 years hold?
2024-01-17 08:00:00,Food manufacturers struggling more with inflation than other sectors
2024-01-17 08:00:00,Tobacco and alcohol fuel surprise inflation rise
2024-01-15 08:00:00,Spotlight*Egypt
2024-01-17 08:00:00,What a drag – the impact of the frozen personal allowance on those with lower incomes
2024-01-18 08:00:00,The countries which raised rates first are now cutting them
2024-01-16 08:00:00,UK pay growth slows as inflation pressure weakens
2024-01-15 08:00:00,Nigeria's inflation rises to more than 27-year high in December
2024-01-17 08:00:00,UK mobile and broadband customers face price hikes of 8% as inflation rises
2024-01-16 08:00:00,Canada's December inflation dashes hopes of early rate cut
2024-01-17 08:00:00,UK inflation unexpectedly rises as cost of tobacco and alcohol increases
2024-01-16 08:00:00,BT scraps above-inflation price rises for mobile and broadband customers
2024-01-17 08:00:00,Explainer: What is the outlook for UK inflation in 2024?
2024-01-17 08:00:00,"Index of Private Housing Rental Prices, UK: December 2023"
2024-01-17 11:04:36,Inflation Expectations and Price Setting Among Fifth District Firms
2024-01-19 08:00:00,China import tariffs exacerbate Russian coal export woes
2024-01-20 08:00:00,Capital Gains Tax – the triple threat to investors
2024-01-17 08:00:00,Beyond the average: patterns in UK price data at the micro level
2024-01-18 18:00:53,UK finance chief warns Trump: Return to protectionism a ‘profound mistake’
2024-01-19 08:00:00,There are other ways to tackle the cost of living crisis — just ask France and Spain
2024-01-18 08:00:00,Pros and cons of inflation
2024-01-15 08:00:00,No extra European import taxes on US motorcycles (yet)
2024-01-19 08:00:00,Inflation rose rapidly | Sveriges Riksbank
2024-01-18 08:00:00,Portugal: Starting 2024 on a weaker footing after tourism recovery falters
2024-01-15 08:00:00,UK annual wage growth slows to 6.5%
2024-01-17 08:00:00,UK inflation sees unexpected rise in December 2023
2024-01-16 08:00:00,Supply chain in mining: The race for critical raw materials
2024-01-17 08:00:00,Equities Haven't Always Beaten Bonds. Should I Care?
2024-01-14 08:00:00,Inflation hits UK funeral costs as prices rise for first time since pandemic
2024-01-19 08:00:00,"ECB could consider dual interest rates, Schnabel says"
2024-01-17 08:00:00,"Should you be worried by inflation? How rise affects bills, mortgages and savings"
2024-01-17 08:00:00,Inflation-linked pricing: BT drops policy ahead of expected Ofcom clampdown
2024-01-18 08:00:00,German union pay demand of 21% raises inflation fears
2024-01-18 08:00:00,Union win for Turkish metalworkers amid record inflation
2024-01-17 08:00:00,What the Breakfast Index Told Us About Rampant UK Food Inflation
