date,title
2024-07-04 07:00:00,Britain's FTSE 100 up nearly 1% with Labour favoured to win election
2024-07-03 07:00:00,General and food consumer price indices inflation rates. March 2024 update
2024-07-05 07:00:00,Red Sea attacks trigger fresh inflation fears as shipping plunges
2024-07-03 07:00:00,"Best EV charging tariffs: our top five picks, updated for July 2024 price cap"
2024-07-02 07:00:00,The London Question: Why is Pret so expensive now?
2024-06-30 07:00:00,"Wall St Week Ahead Jobs, inflation data may break the US Treasury market out of narrow range"
2024-07-05 07:00:00,Serbia-China FTA slashes tariffs on Serbian wine
2024-07-02 07:00:00,"Fed's Powell says US on 'disinflationary path,' but more data needed before rate cuts"
2024-07-01 07:00:00,Child malnutrition crisis in Nigeria amid rural violence and soaring food inflation
2024-07-04 07:00:00,"Automatic tyre inflation is coming to gravel, thanks to Gravaa's €4,000 system"
2024-07-01 07:00:00,Take Trump Seriously When He Says Tariffs Will Pay For Tax Reform
2024-07-06 07:00:00,Can Labour really bring down mortgage rates?
2024-07-02 07:00:00,Powell Cites ‘Real Progress’ as Central Bankers Assess Inflation Fight
2024-07-02 07:00:00,"New Zealand Finalizes Historic Trade Deal with Costa Rica, Iceland, and Switzerland to Eliminate Tariffs on Sustainable Goods"
2024-07-05 07:00:00,"FTSE 100 Live 05 July: Housebuilders surge after Labour win, Shell in $2bn setback"
2024-07-04 07:00:00,Whisky faces double import tariffs in Russia amid sanctions row
2024-07-01 07:00:00,Financial stability analysis of large changes in interest rates
2024-07-02 07:00:00,ECB's Lagarde welcomes small inflation fall despite stubborn services
2024-07-03 07:00:00,"Change to the Plan 2, Plan 5 and Plan 3 (“Postgraduate (PG)”) student loan interest rates announcement"
2024-07-04 11:17:09,Here’s How Quickly Interest Rates Are Expected To Come Down
2024-07-02 07:00:00,Farm Businesses Well-Positioned Financially Despite High Interest Rates
2024-07-02 07:00:00,H2 2024 UK Economic and Consumer Forecast
2024-07-04 07:00:00,Russia to double whisky tariffs in revenge for sanctions
2024-07-03 07:00:00,German car industry urges EU to drop tariffs on China-made cars
2024-07-01 07:00:00,The 10 highest dividend-yield FTSE 100 stocks of July 2024
2024-07-05 07:00:00,China steps up pressure with EU brandy probe hearing as EV tariffs begin
2024-07-04 07:00:00,Europe Tells China’s Carmakers: Get Ready to Pay Tariffs
2024-07-04 07:00:00,Carmakers respond to EU tariffs on Chinese-made EVs
2024-07-04 07:00:00,History suggests FTSE 100 stocks will do this after the UK general election
2024-07-01 07:00:00,ECB’s Lane Says Data Needed Beyond June to Clarify Services Path
2024-07-10 07:00:00,Inflation-linked bonds: more than just inflation
2024-07-11 07:00:00,Rising cost of living in the UK
2024-07-08 07:00:00,UK inflation: What's done and what's to come
2024-07-10 07:00:00,Softer-than-expected June inflation continues to bolster the case for easing in China
2024-07-10 07:00:00,US targets Chinese steel exports with tariffs on shipments via Mexico
2024-07-09 07:00:00,Prospects For Inflation Have Worsened – An Updated Complex MRN Inflation Forecast
2024-07-12 07:00:00,China posts record trade surplus as foreign importers rush to beat tariffs
2024-07-08 07:00:00,"Interest rates should be held again in August, says rate-setter"
2024-07-10 07:00:00,Spotlight*KSA: Views On Inflation
2024-07-11 07:00:00,US inflation cools to slowest pace in a year
2024-07-12 07:00:00,“UK inflation: What's done and what's to come?”
2024-07-12 07:00:00,"Inflation cools, election heats up"
2024-07-11 07:00:00,US hits Chinese steel and aluminium imports via Mexico with tariffs
2024-07-11 07:00:00,Soft US inflation boosts confidence in a return to target
2024-07-07 07:00:00,"A very deep dive into UK inflation predictions. Like, maybe too deep"
2024-07-08 07:00:00,"Bank of England should keep interest rates on hold, says policymaker"
2024-07-10 07:00:00,US tightens tariffs on Mexican steel and aluminium imports
2024-07-11 07:00:00,US inflation falls to 3% in June
2024-07-09 07:00:00,US Federal Reserve chair Jay Powell hails ‘considerable progress’ in tackling inflation
2024-07-11 07:00:00,Sterling surges to one-year high after UK growth and US inflation surprises
2024-07-09 07:00:00,"Cutting interest rates ‘too late or too little’ could hit jobs, Fed chair warns"
2024-07-13 07:00:00,Mortgage competition hots up as interest rates decision looms
2024-07-10 07:00:00,How EU funding programmes could counterbalance the US Inflation Reduction Act
2024-07-10 07:00:00,Inflation causes fifth of UK apparel shoppers to switch to cheaper brands
2024-07-10 07:00:00,China June consumer inflation misses forecasts amid anaemic demand
2024-07-09 07:00:00,The biggest casualty in the EU’s China EV tariffs? The climate | Article
2024-07-08 07:00:00,"Migration, inflation and vacation"
2024-07-10 07:00:00,Bank of England’s top economist Huw Pill ‘uncomfortable’ with persistence of inflation
2024-07-12 07:00:00,FTSE 100 hits one-week high after soft US inflation data
2024-07-11 07:00:00,Inflation and economic activity in the United States: the return of the Phillips curve?
2024-07-10 07:00:00,Biden Administration adjusts tariffs on Mexican steel imports
2024-07-10 07:00:00,What will happen to tax and interest rates under Labour – and how will benefits change?
2024-07-09 07:00:00,Could new EU tariffs on Chinese imports slow EV adoption?
2024-07-11 07:00:00,Monthly US consumer prices post first drop in four years as inflation subsides
2024-07-10 07:00:00,Chinese carmaker to avoid paying tariffs on electric car exports to Britain
2024-07-09 07:00:00,Power of good: how solar sponge tariffs can be a win for your pocket and the planet | Peter Mares
2024-07-10 07:00:00,The Fed may soon cut interest rates. That could make your next trip abroad more expensive
2024-07-11 07:00:00,June price drop may shorten the Fed's last mile on inflation
2024-07-08 07:00:00,"BMW seeks lower import tariffs for China-made electric Mini, source says"
2024-07-09 07:00:00,Powell Welcomes Cooling Inflation but Wants ‘More Good Data’ Before Rate Cut
2024-07-08 07:00:00,RBI’s options for tackling climate change-induced inflation
2024-07-11 07:00:00,Cooling inflation may pave way for interest rate cut soon
2024-07-11 07:00:00,Inflation News Is Still Exaggerated by Dubious Shelter Estimates
2024-07-11 07:00:00,"Inflation rate June 2024: What is it, and what it means for the U.S. economy"
2024-07-11 07:00:00,"High inflation is largely not Biden's or Trump's fault, economists say"
2024-07-08 07:00:00,FTSE 100 today: London markets brace for caution amid French election deadlock
2024-07-11 07:00:00,Here's why housing inflation is still stubbornly high
2024-07-09 07:00:00,The Income Investor: two FTSE 100 stocks where dividends count
2024-07-11 07:00:00,​​Five cheap FTSE 100 stocks to watch​
2024-07-12 07:00:00,US inflation cools – plus other economics stories to read this week
2024-07-11 07:00:00,Pound at near year-long high against dollar after US inflation figure announced
2024-07-11 07:00:00,"Global stock index falls with bond yields, dollar after US inflation data"
2024-07-10 07:00:00,AI deepfake scams hit FTSE 100 bosses
2024-07-12 07:00:00,FTSE 100 Live: Market ends high note as nation prepares to cheer Three Lions to victory
2024-07-11 07:00:00,"Inflation falls 0.1% in June from prior month, helping case for lower rates"
2024-07-08 07:00:00,"FTSE 100 Live: Britvic backs £3.3bn Carlsberg deal, index steady"
2024-07-11 07:00:00,Fed's Goolsbee says US economy looks back on track to 2% inflation
2024-07-11 07:00:00,"FTSE 100 Live 11 July: GDP recovery continues, index higher but lags global progress"
2024-07-08 07:00:00,Insider: directors buy this ‘undervalued’ FTSE 100 share
2024-07-08 07:00:00,Small business energy suppliers – compare 2024 tariffs
2024-07-10 07:00:00,"Inflation will go up regardless of who the next president is, but under Trump’s tariffs it would be higher for longer, Oxford Economics says"
2024-07-09 07:00:00,Turkey's statistics chief defends inflation calculations
2024-07-12 07:00:00,"Germany set to abstain in vote on EU tariffs for China EVs, sources say"
2024-07-10 07:00:00,Biden Announces Tariffs on Chinese Metals Routed Through Mexico
2024-07-08 07:00:00,"Equities edge higher with US 10-year yield, Powell and inflation in focus"
2024-07-08 07:00:00,"FTSE 100 Live: Stocks flat, Carlsberg to buy Pepsi maker Britvic, Metro offloading mortgage book"
2024-07-10 07:00:00,"FTSE 100 Live 10 July: Barratt completions set to fall, JD Wetherspoon posts record sales"
2024-07-09 07:00:00,US Treasury's Yellen: inflation will continue to ease over time
2024-07-12 07:00:00,BAE Systems isn’t the only FTSE 100 stock I’d consider buying for lasting passive income
2024-07-11 07:00:00,These FTSE 100 shares are undervalued by as much as 44%!
2024-07-09 07:00:00,Surging population growth from immigration may have little effect on inflation
2024-07-11 07:00:00,Here's the inflation breakdown for June 2024 — in one chart
2024-07-12 07:00:00,JPMorgan's Jamie Dimon warns inflation and interest rates may stay higher
2024-07-09 07:00:00,Melrose founders eye FTSE 100 spot for new listed buyout vehicle
2024-07-10 07:00:00,"US, Mexico move to thwart China circumvention of tariffs"
2024-07-12 07:00:00,"Inflation eased further in June, helping cement path to rate cuts"
2024-07-09 07:00:00,London markets slip as BP share slump drags on FTSE 100
2024-07-13 07:00:00,Food prices are no longer rising as much — but here's why it might not feel that way
2024-07-10 07:00:00,Japan's wholesale inflation picks up as weak yen raises import costs
2024-07-10 07:00:00,Questor: Believe in this FTSE 100- beating hidden gem as Gary Channon has
2024-07-12 07:00:00,Inflation Weighs on Nation’s Largest Banks
2024-07-12 07:00:00,Five AIM share tips for 2024: beating the FTSE 100
2024-07-12 07:00:00,US producer price data points to subsiding inflation pressures
2024-07-11 07:00:00,"Inflation Fell in June, Giving Consumers a Break and Adding to Fed Rate-Cut Hopes"
2024-07-11 07:00:00,"Gold Tops $2,400 as Drop in Inflation Bolsters Rate Cut Optimism"
2024-07-11 07:00:00,Inflation falls in June for first time since 2020 as consumer price increases continue to slow
2024-07-09 07:00:00,Inflation up to 3.2 percent in June
2024-07-11 07:00:00,"US inflation cools again, potentially paving way for Fed to cut interest rates soon"
2024-07-11 07:00:00,IMF sees US Fed in position to cut interest rates later this year
2024-07-10 07:00:00,Biden administration to tax foreign-made steel and aluminum imports routed through Mexico
2024-07-11 07:00:00,Prices fell in June for the first time since the start of the pandemic
2024-07-12 07:00:00,US consumer sentiment ebbs in July; inflation expectations improve
2024-07-12 07:00:00,"Ohio Utility Proposes New Data Center Tariffs, Angers Tech Giants"
2024-07-10 07:17:55,BI Governor: Indonesia Manages to Maintain Low Inflation Rate
2024-07-10 07:00:00,"Grocery inflation might be falling, but consumers are still 'feeling the burn' of high food costs"
2024-07-09 07:00:00,Clothing and footwear: Wearing down inflation
2024-07-17 07:00:00,Why Isn't UK Inflation Falling? Blame Taylor Swift and the Euros
2024-07-19 07:00:00,What would be the implications of tariffs on Chinese EVs?
2024-07-17 07:00:00,Hopes of August rate cut fall after UK inflation stays at 2%
2024-07-18 07:00:00,2 Per Cent Inflation Target Met – But For How Long?
2024-07-17 07:00:00,UK inflation holds steady despite fall in clothes prices
2024-07-17 07:00:00,How is inflation affecting business? | Allianz Trade UK
2024-07-17 07:00:00,Why Labour is right to hold off on Chinese EV tariffs
2024-07-17 07:00:00,Inflation drops to 2% – but it’s not all good news | industry experts explain why
2024-07-17 07:00:00,Pound hits one-year high against dollar after UK inflation holds steady
2024-07-16 07:00:00,"Interest rates could stay higher for longer, warns IMF"
2024-07-17 07:00:00,Bank of England economists will not be panicking over inflation data
2024-07-18 10:47:39,How to invest in the FTSE 100
2024-07-17 07:00:00,U.K. Inflation Steady as Economists Puzzle Over ‘Taylor Swift Effects’
2024-07-17 07:00:00,"UK inflation pressures stay hot, reducing chance of August rate cut"
2024-07-16 07:00:00,"Falling inflation, football and fake tan: summer events shape shopping habits"
2024-07-16 07:00:00,Inflation Predicted to Rise to As Much As 2.4 Per Cent in this Month’s Figures
2024-07-19 07:00:00,"Ofcom to ban inflation-linked mid-contract price rises on phones, pay-TV and broadband"
2024-07-15 07:00:00,UK Inflation: What to Expect from June's Data
2024-07-18 07:00:00,Inflation: 'Our local café is a once a month treat'
2024-07-16 07:00:00,UK says it is not about to impose tough tariffs on Chinese EV imports
2024-07-17 07:00:00,UK inflation rate calculator: How much are prices rising for you?
2024-07-20 07:00:00,"Wave of shipping inflation could complicate rate cuts, economists warn"
2024-07-19 07:00:00,Egypt holds rates as inflation recedes
2024-07-17 07:00:00,"UK inflation stays at 2%, defying forecasts of a further dip; pound rises to $1.30 – as it happened"
2024-07-15 07:00:00,Inflation Forecasting: The Devil’s in the Details
2024-07-18 07:00:00,Wages grew at the fastest rate since August 2021 when measured against inflation
2024-07-17 07:00:00,‘Taylor Swift effect’ stops inflation dropping below 2% as calls grow for rate cut
2024-07-19 07:00:00,"Inflation-linked broadband, mobile and TV price hikes to be banned from next year"
2024-07-18 07:00:00,Interest rate reduction on the Court Funds Office special and basic accounts
2024-07-16 07:00:00,Low growth: The economy’s biggest challenge
2024-07-18 07:00:00,"Food price inflation fell, but it’s not all good news"
2024-07-18 07:00:00,Trump + Vance = ‘Tariffs are coming’
2024-07-19 07:00:00,Migration and inflation nexus under high and low interest rate environments: Some panel data evidence
2024-07-17 07:00:00,New report looks at inflation’s impact on European luxury
2024-07-18 07:00:00,"ECB keeps rates unchanged, September move ""wide open"""
2024-07-18 07:00:00,Why has inflation stayed the same and what is the ‘Taylor Swift effect’?
2024-07-17 07:00:00,"UK inflation stays at 2% target in June, leaving possible rate cut on a 'knife edge'"
2024-07-15 07:00:00,New EV charging tariffs for car parks
2024-07-15 07:00:00,US unemployment or inflation will worsen if vacancies do not fall – study
2024-07-18 07:00:00,Pay grows at slowest rate for almost two years
2024-07-19 07:00:00,Statement on new Ofcom rules on inflation-linked price increases
2024-07-17 07:00:00,Understanding new EU tariffs on China-made electric cars
2024-07-17 07:00:00,High hotel prices cause inflation headache
2024-07-16 07:00:00,"World Economic Outlook Update, July 2024: The Global Economy in a Sticky Spot"
2024-07-16 07:00:00,Capacity pressures in health and social care in England
2024-07-17 07:00:00,Flatlining UK inflation may delay rate cuts
2024-07-17 07:00:00,When will the Bank of England cut interest rates?
2024-07-18 07:00:00,The Risk of Inflation Dispersion in the Euro Area
2024-07-16 07:00:00,"EU may cut China EV import tariffs for Volkswagen and BMW, sources say"
2024-07-19 07:00:00,"Euro zone inflation will continue easing, may fall below 2% in 2026, ECB survey shows"
2024-07-14 07:00:00,When will the ECB next cut interest rates?
2024-07-15 07:00:00,"Nigeria's inflation hit new 28-year high in June, may have peaked"
2024-07-17 07:00:00,'Coming back from a high-inflation economy'
2024-07-16 07:00:00,Global Growth Steady Amid Slowing Disinflation and Rising Policy Uncertainty
2024-07-19 07:00:00,Phone and broadband mid-contract price surprise rises banned
2024-07-18 07:00:00,ECB keeps interest rate at 3.75%
2024-07-19 07:00:00,Ofcom bans telcos from enacting inflation-linked mid-contract price rises
2024-07-19 07:00:00,EU to set tariffs on Chinese biodiesel in anti-dumping probe
2024-07-18 07:00:00,Inflation rate remains at Bank of England's 2% target rate
2024-07-16 07:00:00,"New inflation warning: Get used to high interest rates, IMF says"
2024-07-17 07:00:00,The Times view on Swiftonomics: Inflation Can Be Fun
2024-07-16 07:00:00,IMF warns of ‘bumps’ on road to lower inflation
2024-07-15 07:00:00,‘This just isn’t going to add up’: experts warn Trumponomics would hurt US
2024-07-17 07:00:00,Pound hits highest level against dollar for a year
2024-07-19 07:00:00,Would Trump's tariff proposals lift the US economy or break it?
2024-07-15 07:00:00,ECB Rates Decision: What to Expect on July 18
2024-07-17 07:00:00,"Federal spending was responsible for the 2022 spike in inflation, research shows"
2024-07-18 07:00:00,US Companies Boost Imports in Rush to Avoid Tariffs
2024-07-19 11:08:12,Aira and Octopus launch new cut-price tariff
2024-07-16 07:00:00,"UK grocery inflation falls to 1.6%, says Kantar"
2024-07-18 07:00:00,Prologis CEO worried about ‘the second-order’ effect of tariffs
2024-07-15 07:00:00,Fed's Powell: Latest data 'add somewhat to confidence' inflation is returning to 2%
2024-07-17 07:00:00,eyeQ: should I buy the FTSE 100 or FTSE 250?
2024-07-17 07:00:00,Chinese car makers optimistic UK not planning to follow EU on tariffs
2024-07-15 23:29:43,What could a second Trump presidency mean for shipping — and shipping stocks?
2024-07-17 07:00:00,"Trump claims Apple CEO gifted him $6,000 Macbook after lowering import tariffs"
2024-07-18 07:00:00,UK jobs market cools again as wage growth slows
2024-07-16 07:00:00,"EU countries divided on Chinese EV tariffs in vote, sources say"
2024-07-17 07:00:00,Taylor Swift’s tour kept up inflation – but the Bank of England can just shake it off
2024-07-18 07:00:00,European Central Bank stands firm as it holds interest rates at 3.75%
2024-07-16 07:00:00,"Trump 2.0 could be bad news for global inflation, analysts say"
2024-07-18 07:00:00,"If I’d put £5k in a FTSE 100 index fund 10 years ago, here’s what I’d have now!"
2024-07-19 07:00:00,"Angola central bank keeps interest rate steady, sees inflation easing"
2024-07-18 07:00:00,Stagflation from higher tariffs: 1970s redux?
2024-07-14 07:00:00,Germany’s doner kebab becomes symbol of angst over rising costs
2024-07-17 07:00:00,UK inflation rate remains unchanged at 2% in June – what it means for your money
2024-07-17 07:00:00,REACTION: Inflation holds at 2% but household costs still at historic highs
2024-07-17 07:00:00,Sportswear offsets rising prices but inflation remains flat
2024-07-15 07:00:00,Feel like you’re spending more on coffee than ever? You are.
2024-07-18 07:00:00,"ECB won't debate inflation target, dot plot in upcoming review"
2024-07-16 07:00:00,Trump Tells ‘Lovely’ EU to Brace for Tariffs
2024-07-18 07:00:00,E.C.B. Leaves Rates Unchanged but Keeps Door Open for September
2024-07-19 07:00:00,ECB leaves key interest rates unchanged
2024-07-17 07:00:00,Trump May Find a Weak Dollar Isn’t Easy to Come By
2024-07-16 07:00:00,UK energy retailers add heat pump tariffs
2024-07-16 07:00:00,UK Weighs Response After EU Imposes Tariffs on China EV Imports
2024-07-19 07:00:00,"FTSE 100 Live: UK stocks plummet, US markets resilient as global IT outage sparks mayhem"
2024-07-18 07:00:00,Volvo Cars blames EU tariffs as it cuts 2024 sales forecast
2024-07-20 07:00:00,Charting the Global Economy: UK Services Inflation Tops Forecast
2024-07-15 07:00:00,Fed getting 'more good' inflation data leading to rate cut: Chair Powell
2024-07-25 07:00:00,"320,000 people pushed into poverty because of mortgage interest rate rises"
2024-07-26 07:00:00,Hedging inflation: Fundamentals and scarcity
2024-07-23 07:00:00,Different household – different inflation rate
2024-07-25 07:00:00,Guernsey's inflation rate remains stubbornly high
2024-07-22 07:00:00,How to cut the UK debt interest bill
2024-07-21 07:00:00,Chancellor Rachel Reeves hints at above-inflation public sector pay rise
2024-07-24 07:00:00,"FTSE 100 CEOs’ backgrounds, career paths and pay in numbers"
2024-07-22 07:00:00,When Will the Fed Start Cutting Interest Rates?
2024-07-22 07:00:00,Rachel Reeves hints she’ll give nurses and teachers above-inflation pay rises
2024-07-26 07:00:00,FOMC preview: Growing confidence of a Fed rate cut in September
2024-07-21 07:00:00,Why the Federal Reserve is waiting a bit longer to lower interest rates
2024-07-26 07:00:00,What’s New
2024-07-21 07:00:00,UK finance minister hints at above-inflation pay rises for public sector workers
2024-07-26 07:00:00,Millions of UK public sector workers set for above-inflation pay rise
2024-07-22 07:00:00,Macro implications of the US Elections
2024-07-25 07:00:00,Quantifying the hit to industry from a second Trump presidency
2024-07-21 07:00:00,Rachel Reeves hints at above-inflation public sector pay rises in Laura Kuenssberg interview
2024-07-24 07:00:00,Who’s who in the FTSE 100
2024-07-24 07:00:00,Accelerating wage growth is another inflation risk for Hungary
2024-07-22 07:00:00,China cuts interest rates in bid to prop up lagging economic growth
2024-07-26 07:00:00,Amundi CIO Mortier: Markets have yet to price in the risk of a Trump-fuelled inflation rebound
2024-07-21 07:00:00,Reeves hints public sector workers could get above-inflation pay rises
2024-07-26 07:00:00,Your food is more expensive – are US corporate profits to blame?
2024-07-25 07:00:00,2024 News items
2024-07-21 07:00:00,Rachel Reeves hints at imminent above-inflation pay deals for teachers and nurses
2024-07-22 07:00:00,Reeves hints at above-inflation pay rise for public servants
2024-07-25 07:00:00,Midyear inflation below historical average for most food categories in 2024
2024-07-24 07:00:00,"Bank of England to cut interest rates in August, economists forecast"
2024-07-25 07:00:00,Ex US trade official: Trump tariffs on Chinese goods could offer ‘top cover’ for EU measures
2024-07-26 07:00:00,"As inflation recedes, has the tide turned on discounter growth?"
2024-07-22 07:00:00,"Greek tourism benefiting from Türkiye’s inflation crisis, say experts"
2024-07-23 07:00:00,Hungary cuts key interest rates and vows careful and patient approach
2024-07-23 07:00:00,How will the Fed and ECB change their monetary strategies?
2024-07-26 07:00:00,ECB's Schnabel still sees tough 'last mile' in inflation fight
2024-07-21 07:00:00,Growing inflation in UK’s service-based economy was never going to be easy | Larry Elliott
2024-07-24 07:00:00,"South African rand recoups some losses, inflation slows"
2024-07-24 07:00:00,"Bank of Canada cuts interest rates once more, trims growth prospects"
2024-07-23 07:00:00,Is Britain’s economy finally moving?
2024-07-24 07:00:00,Sri Lanka cuts interest rates by 25bp
2024-07-26 07:00:00,Bank of Ghana keeps main rate unchanged over inflation concerns
2024-07-24 07:00:00,"Soaring UK mortgage rates have pushed 320,000 adults into poverty, thinktank says"
2024-07-24 07:00:00,FTSE 100 live: Shares slide despite easyJet boost as tech sell-off whacks Wall Street
2024-07-23 07:00:00,Nationwide: Major lender lowers mortgage rate to below 4%
2024-07-22 07:00:00,Restaurants sit half-empty in Turkey this summer as inflation reaches 91% in places sending tourists and locals flocking to neighboring Greece
2024-07-25 07:00:00,"US economic growth ramps up, growing 2.8% in latest quarter | US economy"
2024-07-26 07:00:00,"Battling Inflation, Russia Raises Key Interest Rate to 18 Percent"
2024-07-23 07:00:00,Interest rate update: strategies for financial advisers
2024-07-23 07:00:00,"The New Rules of Trade with China: Navigating Tariffs, Turmoil, and Opportunities"
2024-07-26 07:00:00,Fact Check: FTSE 100 fluctuations on July 5 not evidence Britain’s Labour crashed economy
2024-07-26 07:00:00,Fed seen on track for September rate cut after good inflation data
2024-07-24 07:00:00,"Chinese officials warn of risks from higher US tariffs, urge US business leaders to help mend ties"
2024-07-26 07:00:00,Unilever lauds ‘carryover pricing’ from historic inflation for $6.4 billion profits
2024-07-23 07:00:00,Nigeria central bank hikes rate further as inflation bites
2024-07-24 07:00:00,Trading Strategies: a FTSE 100 company with solid fundamentals
2024-07-25 07:00:00,"FTSE 100 Live: Wise shares halted, Revolut receives banking licence"
2024-07-26 07:00:00,Shares for the future: this FTSE 100 stock owns its market
2024-07-22 07:00:00,Insider: half-dozen directors bet on FTSE 100 stock’s recovery
2024-07-23 07:00:00,"South African rand weakens, eyes on inflation data"
2024-07-26 07:00:00,"Fed’s key inflation gauge rose 2.5% in June from a year ago, easing path to rate cut"
2024-07-24 07:00:00,Reckitt Benckiser: a FTSE 100 stock at big discount to peers
2024-07-22 07:00:00,Financial Stability Implications of Emerging Market Currency Developments
2024-07-26 07:00:00,RYANAIR CHALLENGES UNJUSTIFIED INCREASE IN AIRPORT TARIFFS AT ATHENS
2024-07-26 07:00:00,Bank of Japan to raise rates twice in 2024
2024-07-22 07:00:00,EU to impose tariffs on Chinese biodiesel
2024-07-24 07:00:00,Inflation has put 433 golf clubs at risk of closure
2024-07-23 07:00:00,Venezuela inflation has cooled — but voters say they still can’t make ends meet
2024-07-22 07:00:00,BYD raises European stakes with Turkish investment
2024-07-22 07:00:00,Bank of Canada expected to cut rates this week as inflation slows
2024-07-21 07:00:00,Geopolitics overtakes inflation at top of sovereign wealth fund worry list
2024-07-26 07:00:00,Cooling US inflation bolsters September rate cut hopes
2024-07-24 07:00:00,"Europe’s Biggest Paintmaker Warns EU, US Chemical Tariffs on China to Spur Prices"
2024-07-22 07:00:00,Fed may be on cusp of emerging from 'elevated' inflation blues
